issueID,issuer,name1,typeID,typeShort,typeLong,expmat
27694,19574912,"Heng Hup Holdings Limited",0,O,"Ordinary shares",NULL
3111,15346,"HENG TAI CONSUMABLES GROUP LIMITED",0,O,"Ordinary shares",NULL
3339,18154,"Heng Xin China Holdings Limited",0,O,"Ordinary shares",NULL
1893,7380,"HENGAN INTERNATIONAL GROUP COMPANY LIMITED",0,O,"Ordinary shares",NULL
4633,29547,"Hengdeli Holdings Limited",0,O,"Ordinary shares",NULL
16122,2401311,"HENGTAI SECURITIES CO., LTD",6,H,H-share,NULL
6498,62976,"HENGXIN TECHNOLOGY LTD.",0,O,"Ordinary shares",NULL
12301,2158780,"Hengxing Gold Holding Company Limited",0,O,"Ordinary shares",NULL
3141,15780,"Hephaestus Holdings Limited",0,O,"Ordinary shares",NULL
1082,4863,"HERALD HOLDINGS LIMITED (BM)",0,O,"Ordinary shares",NULL
36019,31739886,"Herbs Generation Group Holdings Limited",0,O,"Ordinary shares",NULL
28206,22694340,"Hevol Services Group Co. Limited",0,O,"Ordinary shares",NULL
22195,2456486,"HG Semiconductor Limited (KY)",0,O,"Ordinary shares",NULL
111,1361,"Hi Sun Technology (China) Limited",0,O,"Ordinary shares",NULL
4900,41012,"Hidili Industry International Development Limited",0,O,"Ordinary shares",NULL
1083,4864,"HIGH FASHION INTERNATIONAL LIMITED",0,O,"Ordinary shares",NULL
34846,27761462,"HighTide Therapeutics, Inc.",0,O,"Ordinary shares",NULL
6808,64918,"Hilong Holding Limited",0,O,"Ordinary shares",NULL
12833,152644,"Hin Sang Group (International) Holding Co. Ltd.",0,O,"Ordinary shares",NULL
5137,49592,"Hing Lee (HK) Holdings Limited",0,O,"Ordinary shares",NULL
23192,2579683,"Hing Ming Holdings Limited",0,O,"Ordinary shares",NULL
993,4796,"Hing Yip Holdings Limited (BM)",0,O,"Ordinary shares",NULL
26670,12611509,"HINGTEX HOLDINGS LIMITED",0,O,"Ordinary shares",NULL
1069,4851,"Hisense Home Appliances Group Co., Ltd.",6,H,H-share,NULL
26849,2587524,"HK Asia Holdings Limited",0,O,"Ordinary shares",NULL
11733,2176859,"HK Electric Investments Limited",0,O,"Ordinary shares",NULL
13619,2357841,"HKBN Ltd.",0,O,"Ordinary shares",NULL
12797,433,"HKC (HOLDINGS) LIMITED",1,Wrnt,Warrant,2015-10-15
5096,433,"HKC (HOLDINGS) LIMITED",1,Wrnt,Warrant,2011-05-21
6024,433,"HKC (HOLDINGS) LIMITED",1,Wrnt,Warrant,2011-06-08
5007,433,"HKC (HOLDINGS) LIMITED",1,Wrnt,Warrant,2009-11-30
261,433,"HKC (HOLDINGS) LIMITED",0,O,"Ordinary shares",NULL
3510,16029,"HKC INTERNATIONAL HOLDINGS LIMITED",0,O,"Ordinary shares",NULL
26161,12109610,"HKE Holdings Limited",0,O,"Ordinary shares",NULL
271,462,"HKR INTERNATIONAL LIMITED",0,O,"Ordinary shares",NULL
7176,133763,"HKT Limited (KY)",0,O,"Ordinary shares",NULL
22221,2559652,"HM International Holdings Limited",0,O,"Ordinary shares",NULL
2620,11385,"hmvod Limited",0,O,"Ordinary shares",NULL
35205,30248660,"Hollwin Urban Operation Service Group Co., Ltd",6,H,H-share,NULL
18109,2456788,"Holly Futures Co., Ltd.",6,H,H-share,NULL
28617,23378242,"Home Control International Limited",0,O,"Ordinary shares",NULL
28141,22233814,"Homeland Interactive Technology Ltd.",0,O,"Ordinary shares",NULL
27216,13688724,"Hon Corporation Limited",0,O,"Ordinary shares",NULL
97,1060,"Hon Kwok Land Investment Company, Limited",0,O,"Ordinary shares",NULL
3353,16091,"Honbridge Holdings Limited",0,O,"Ordinary shares",NULL
22,427,"HONG KONG AIRCRAFT ENGINEERING COMPANY LIMITED",0,O,"Ordinary shares",NULL
348,416,"HONG KONG AND CHINA GAS COMPANY LIMITED (THE)",0,O,"Ordinary shares",NULL
4612,28164,"Hong Kong Economic Times Holdings Limited",0,O,"Ordinary shares",NULL
25056,2585390,"Hong Kong Entertainment International Holdings Limited",0,O,"Ordinary shares",NULL
2516,9643,"HONG KONG EXCHANGES AND CLEARING LIMITED",0,O,"Ordinary shares",NULL
34308,9643,"HONG KONG EXCHANGES AND CLEARING LIMITED",0,O,"Ordinary shares",NULL
478,418,"HONG KONG FERRY (HOLDINGS) COMPANY LIMITED",0,O,"Ordinary shares",NULL
11212,2050827,"Hong Kong Finance Group Limited",0,O,"Ordinary shares",NULL
1317,652,"HONG KONG FOOD INVESTMENT HOLDINGS LIMITED",0,O,"Ordinary shares",NULL
28436,22501156,"Hong Kong Johnson Holdings Co., Ltd.",0,O,"Ordinary shares",NULL
3345,16741,"Hong Kong Life Sciences and Technologies Group Limited",0,O,"Ordinary shares",NULL
5021,16741,"Hong Kong Life Sciences and Technologies Group Limited",1,Wrnt,Warrant,2010-06-30
1293,5001,"Hong Kong Shanghai Alliance Holdings Limited",0,O,"Ordinary shares",NULL
1010,4809,"Hong Kong Technology Venture Company Limited",0,O,"Ordinary shares",NULL
11687,1901694,"HONG WEI (ASIA) HOLDINGS COMPANY LIMITED",0,O,"Ordinary shares",NULL
32482,26508495,"HONGCHENG ENVIRONMENTAL TECHNOLOGY COMPANY LIMITED",0,O,"Ordinary shares",NULL
4968,44571,"Honghua Group Limited",0,O,"Ordinary shares",NULL
28,372,"HONGKONG AND SHANGHAI HOTELS, LIMITED (THE)",0,O,"Ordinary shares",NULL
161,1673,"HONGKONG CHINESE LIMITED",0,O,"Ordinary shares",NULL
5018,1673,"HONGKONG CHINESE LIMITED",1,Wrnt,Warrant,2011-07-04
29405,2590936,"Honliv Healthcare Management Group Company Limited",0,O,"Ordinary shares",NULL
21299,2592340,"Honma Golf Limited",0,O,"Ordinary shares",NULL
5551,55684,"Hontex International Holdings Company Limited",0,O,"Ordinary shares",NULL
11737,2144274,"HONWORLD GROUP LIMITED",0,O,"Ordinary shares",NULL
1292,5000,"Hony Media Group",0,O,"Ordinary shares",NULL
3425,18196,"HOP FUNG GROUP HOLDINGS LIMITED",0,O,"Ordinary shares",NULL
4640,4867,"Hop Hing Group Holdings Limited",1,Wrnt,Warrant,2009-04-30
5136,4867,"Hop Hing Group Holdings Limited",1,Wrnt,Warrant,2013-05-31
1086,4867,"Hop Hing Group Holdings Limited",0,O,"Ordinary shares",NULL
15356,2387839,"Hope Life International Holdings Limited",0,O,"Ordinary shares",NULL
3617,21662,"HOPEFLUENT GROUP HOLDINGS LIMITED",0,O,"Ordinary shares",NULL
56,853,"HOPEWELL HOLDINGS LIMITED",0,O,"Ordinary shares",NULL
1391,5440,"HOPSON DEVELOPMENT HOLDINGS LIMITED",0,O,"Ordinary shares",NULL
31694,26626784,"Horizon Construction Development Limited",0,O,"Ordinary shares",NULL
35828,31918889,"Horizon Robotics",8,B,B-share,NULL
6963,66751,"Hosa International Limited",0,O,"Ordinary shares",NULL
23190,2567335,"Hospital Corporation of China Limited",0,O,"Ordinary shares",NULL
33730,27747148,"Howkingtech International Holding Limited",0,O,"Ordinary shares",NULL
26329,2673667,"HPC Holdings Limited (KY)",0,O,"Ordinary shares",NULL
5281,51749,"HSBC China Dragon Fund",10,Unit,Unit,NULL
1088,382,"HSBC HOLDINGS PLC",0,O,"Ordinary shares",NULL
24299,2638318,"HSC Resources Group Limited",0,O,"Ordinary shares",NULL
32837,27889473,"HSI ESG Enhanced Select Index ETF",10,Unit,Unit,NULL
1090,617,"Hsin Chong Group Holdings Limited",0,O,"Ordinary shares",NULL
3317,17721,"Hua Han Health Industry Holdings Limited",0,O,"Ordinary shares",NULL
12852,1095264,"HUA HONG SEMICONDUCTOR LIMITED",0,O,"Ordinary shares",NULL
2481,10491,"HUA LIEN INTERNATIONAL (HOLDING) COMPANY LIMITED",0,O,"Ordinary shares",NULL
26813,15212173,"Hua Medicine",0,O,"Ordinary shares",NULL
1332,5027,"HUA NENG POWER INTERNATIONAL, INC.",6,H,H-share,NULL
1012,4810,"Hua Yin International Holdings Limited",0,O,"Ordinary shares",NULL
1242,4968,"HUABAO INTERNATIONAL HOLDINGS LIMITED",0,O,"Ordinary shares",NULL
9548,1902999,"Huadian Fuxin Energy Corporation Limited",6,H,H-share,NULL
2198,8789,"HUADIAN POWER INTERNATIONAL CORPORATION LIMITED",6,H,H-share,NULL
5001,45997,"Huafa Property Services Group Company Limited",0,O,"Ordinary shares",NULL
33720,27120264,"Huafang Group Inc.",0,O,"Ordinary shares",NULL
33988,27202860,"Huaibei GreenGold Industry Investment Co., Ltd.",6,H,H-share,NULL
19700,2449249,"Huajin International Holdings Limited",0,O,"Ordinary shares",NULL
27341,12086000,"Huakang Biomedical Holdings Company Limited",0,O,"Ordinary shares",NULL
6480,61133,"Huaneng Renewables Corporation Limited",6,H,H-share,NULL
696,3798,"Huanxi Media Group Limited",0,O,"Ordinary shares",NULL
28612,15212172,"HUARCHI GLOBAL GROUP HOLDINGS LIMITED",0,O,"Ordinary shares",NULL
31201,15212172,"HUARCHI GLOBAL GROUP HOLDINGS LIMITED",1,Wrnt,Warrant,2022-05-26
6537,63335,"Huasheng International Holding Limited",0,O,"Ordinary shares",NULL
34688,26982140,"HUASHI GROUP HOLDINGS LIMITED",0,O,"Ordinary shares",NULL
11014,2093840,"Huatai Securities Co., Ltd.",6,H,H-share,NULL
11578,2134490,"Huaxi Holdings Company Limited",0,O,"Ordinary shares",NULL
32943,58943,"Huaxin Cement Co., Ltd.",6,H,H-share,NULL
5550,55675,"Huayu Expressway Group Limited",0,O,"Ordinary shares",NULL
10809,1954105,"HUAZHANG TECHNOLOGY HOLDING LIMITED",0,O,"Ordinary shares",NULL
7310,135720,"Huazhong In-Vehicle Holdings Company Limited",0,O,"Ordinary shares",NULL
6809,65446,"Hui Xian Real Estate Investment Trust",10,Unit,Unit,NULL
6969,66797,"Huicheng International Holdings Limited",0,O,"Ordinary shares",NULL
26538,12816066,"Huifu Limited",0,O,"Ordinary shares",NULL
28885,22923839,"Huijing Holdings Company Limited",0,O,"Ordinary shares",NULL
7303,135637,"Huili Resources (Group) Limited",0,O,"Ordinary shares",NULL
30299,22950728,"Huisen Shares Group Limited",0,O,"Ordinary shares",NULL
11473,46416,"Huishang Bank Corporation Limited",6,H,H-share,NULL
11922,153364,"Huisheng International Holdings Limited",0,O,"Ordinary shares",NULL
32813,26843467,"HUITONGDA NETWORK CO., LTD.",6,H,H-share,NULL
3065,14734,"Huiyin Holdings Group Limited",0,O,"Ordinary shares",NULL
19447,2466551,"Human Health Holdings Limited",0,O,"Ordinary shares",NULL
4713,32998,"Hunan Nonferrous Metals Corporation Limited",6,H,H-share,NULL
12512,2257520,"Hung Fook Tong Group Holdings Limited",0,O,"Ordinary shares",NULL
427,430,"HUNG HING PRINTING GROUP LIMITED",0,O,"Ordinary shares",NULL
11149,152908,"Hunlicar Group Limited",0,O,"Ordinary shares",NULL
1050,4838,"Huscoke Holdings Limited",0,O,"Ordinary shares",NULL
5088,48857,"Hutchison Telecommunications Hong Kong Holdings Limited",0,O,"Ordinary shares",NULL
4524,22764,"HUTCHISON TELECOMMUNICATIONS INTERNATIONAL LIMITED",0,O,"Ordinary shares",NULL
42,366,"Hutchison Whampoa Limited",0,O,"Ordinary shares",NULL
6645,49494,"HUTCHMED (China) Limited",0,O,"Ordinary shares",NULL
33266,27065185,"Huzhou Gas Co., Ltd.",6,H,H-share,NULL
1305,5011,"Hybrid Kinetic Group Limited",0,O,"Ordinary shares",NULL
26698,11794914,"Hyfusin Group Holdings Limited",0,O,"Ordinary shares",NULL
29345,23703300,"Hygeia Healthcare Holdings Co., Limited",0,O,"Ordinary shares",NULL
28869,23395793,"Hygieia Group Limited (KY)",0,O,"Ordinary shares",NULL
19662,2551870,"Hypebeast Limited",0,O,"Ordinary shares",NULL
26,365,"HYSAN DEVELOPMENT COMPANY LIMITED",0,O,"Ordinary shares",NULL
2279,9354,"i-CABLE Communications Limited",0,O,"Ordinary shares",NULL
14009,2370258,"i-Control Holdings Limited",0,O,"Ordinary shares",NULL
26184,11787558,"i.century Holding Limited",0,O,"Ordinary shares",NULL
4557,24661,"I.T LIMITED",0,O,"Ordinary shares",NULL
21358,2590289,"IBI Group Holdings Limited (KY)",0,O,"Ordinary shares",NULL
25654,11791974,"IBO Technology Company Limited",0,O,"Ordinary shares",NULL
28127,23294356,"ICBC CICC USD Money Market ETF",10,Unit,Unit,NULL
28128,23294356,"ICBC CICC USD Money Market ETF",10,Unit,Unit,NULL
11889,2205867,"ICBC CSOP FTSE Chinese Government and Policy Bank Bond Index ETF",10,Unit,Unit,NULL
11890,2205867,"ICBC CSOP FTSE Chinese Government and Policy Bank Bond Index ETF",10,Unit,Unit,NULL
26158,2205867,"ICBC CSOP FTSE Chinese Government and Policy Bank Bond Index ETF",10,Unit,Unit,NULL
22108,2668978,"ICBC CSOP S&P New China Sectors ETF",10,Unit,Unit,NULL
26156,2668978,"ICBC CSOP S&P New China Sectors ETF",10,Unit,Unit,NULL
26157,2668978,"ICBC CSOP S&P New China Sectors ETF",10,Unit,Unit,NULL
13622,2108461,"ICO Group Limited",0,O,"Ordinary shares",NULL
28843,23323316,"Icon Culture Global Company Limited",0,O,"Ordinary shares",NULL
27331,15477553,"iDreamSky Technology Holdings Limited",0,O,"Ordinary shares",NULL
1093,1812,"IDT INTERNATIONAL LIMITED",0,O,"Ordinary shares",NULL
11402,2114425,"IGG Inc",0,O,"Ordinary shares",NULL
967,4778,"Imagi International Holdings Limited",0,O,"Ordinary shares",NULL
16006,2424753,"IMAX China Holding, Inc.",0,O,"Ordinary shares",NULL
34480,28524500,"ImmuneOnco Biopharmaceuticals (Shanghai) Inc.",6,H,H-share,NULL
29407,23129766,"Immunotech Biopharm Ltd",0,O,"Ordinary shares",NULL
34817,29266156,"iMotion Automotive Technology (Suzhou) Co., Ltd.",6,H,H-share,NULL
3099,15154,"Imperial Pacific International Holdings Limited",0,O,"Ordinary shares",NULL
2812,12509,"IMPERIUM FINANCIAL GROUP LIMITED",0,O,"Ordinary shares",NULL
4654,30060,"Imperium Technology Group Limited (KY)",0,O,"Ordinary shares",NULL
28136,150787,"IMPRO PRECISION INDUSTRIES LIMITED",0,O,"Ordinary shares",NULL
25837,4498080,"IMS Group Holdings Limited",0,O,"Ordinary shares",NULL
13696,2344778,"In Construction Holdings Limited",0,O,"Ordinary shares",NULL
25405,9133672,"Indigo Star Holdings Limited",0,O,"Ordinary shares",NULL
1289,2025,"INDUSTRIAL AND COMMERCIAL BANK OF CHINA (ASIA) LIMITED",0,O,"Ordinary shares",NULL
5008,2025,"INDUSTRIAL AND COMMERCIAL BANK OF CHINA (ASIA) LIMITED",1,Wrnt,Warrant,2008-11-06
4784,1689,"Industrial and Commercial Bank of China Limited",6,H,H-share,NULL
29050,23434848,"Infinities Technology International (Cayman) Holding Limited",0,O,"Ordinary shares",NULL
6111,59502,"Infinity Development Holdings Company Limited",0,O,"Ordinary shares",NULL
28857,23483439,"Infinity Logistics and Transport Ventures Limited",0,O,"Ordinary shares",NULL
12640,2259550,"Ingdan, Inc.",0,O,"Ordinary shares",NULL
26666,13204486,"Inkeverse Group Limited",0,O,"Ordinary shares",NULL
25077,2620170,"Inner Mongolia Energy Engineering Co., Ltd.",6,H,H-share,NULL
7020,67278,"Inner Mongolia Yitai Coal Co., Ltd.",6,H,H-share,NULL
3372,16958,"INNO-TECH HOLDINGS LIMITED",0,O,"Ordinary shares",NULL
29114,23789088,"InnoCare Pharma Limited",0,O,"Ordinary shares",NULL
36040,32013431,"InnoScience (Suzhou) Technology Holding Co., Ltd.",6,H,H-share,NULL
2615,11345,"Innovative Pharmaceutical Biotech Limited",0,O,"Ordinary shares",NULL
26798,11783282,"Innovax Holdings Limited",0,O,"Ordinary shares",NULL
27209,16221848,"Innovent Biologics, Inc.",0,O,"Ordinary shares",NULL
3576,20941,"Inspur Digital Enterprise Technology Limited",0,O,"Ordinary shares",NULL
4539,22854,"INTEGRATED DISTRIBUTION SERVICES GROUP LIMITED",0,O,"Ordinary shares",NULL
5910,57273,"Integrated Waste Solutions Group Holdings Limited",0,O,"Ordinary shares",NULL
13710,23472,"Intel Corporation",0,O,"Ordinary shares",NULL
27803,13241193,"IntelliCentrics Global Holdings Ltd.",0,O,"Ordinary shares",NULL
22089,2617001,"International Business Digital Technology Limited (KY)",0,O,"Ordinary shares",NULL
210,1857,"International Business Settlement Holdings Limited",0,O,"Ordinary shares",NULL
2592,11237,"INTERNATIONAL ENTERTAINMENT CORPORATION",0,O,"Ordinary shares",NULL
4929,41602,"International Genius Company",0,O,"Ordinary shares",NULL
11195,2067165,"International Housewares Retail Company Limited",0,O,"Ordinary shares",NULL
5616,56342,"International Mining Machinery Holdings Limited",0,O,"Ordinary shares",NULL
33446,27898236,"Interra Acquisition Corporation",7,A,A-share,NULL
33447,27898236,"Interra Acquisition Corporation",1,Wrnt,Warrant,NULL
4829,38579,"Intime Retail (Group) Company Limited",0,O,"Ordinary shares",NULL
26672,12658400,"Intron Technology Holdings Limited",0,O,"Ordinary shares",NULL
36129,33026489,"Invesco QQQ Trust",10,Unit,Unit,NULL
36130,33026489,"Invesco QQQ Trust",10,Unit,Unit,NULL
36131,33026489,"Invesco QQQ Trust",10,Unit,Unit,NULL
6370,61708,"InvesTech Holdings Limited",0,O,"Ordinary shares",NULL
4521,23250,"IPE GROUP LIMITED",0,O,"Ordinary shares",NULL
6227,60999,"IRC LIMITED",0,O,"Ordinary shares",NULL
4546,23854,"IRICO Group New Energy Company Limited",6,H,H-share,NULL
22285,2609031,"ISDN HOLDINGS LIMITED",0,O,"Ordinary shares",NULL
32419,27371510,"iShares China Government Bond ETF",10,Unit,Unit,NULL
32420,27371510,"iShares China Government Bond ETF",10,Unit,Unit,NULL
32421,27371510,"iShares China Government Bond ETF",10,Unit,Unit,NULL
5560,55877,"iShares Core CSI 300 Index ETF",10,Unit,Unit,NULL
23118,55877,"iShares Core CSI 300 Index ETF",10,Unit,Unit,NULL
23119,55877,"iShares Core CSI 300 Index ETF",10,Unit,Unit,NULL
21933,2660225,"iShares Core Hang Seng Index ETF",10,Unit,Unit,NULL
21934,2660225,"iShares Core Hang Seng Index ETF",10,Unit,Unit,NULL
21935,2660225,"iShares Core Hang Seng Index ETF",10,Unit,Unit,NULL
20526,2595794,"iShares Core KOSPI 200 Index ETF",10,Unit,Unit,NULL
20527,2595794,"iShares Core KOSPI 200 Index ETF",10,Unit,Unit,NULL
20528,2595794,"iShares Core KOSPI 200 Index ETF",10,Unit,Unit,NULL
21542,51898,"iShares Core MSCI AC Asia ex Japan Index ETF",10,Unit,Unit,NULL
21543,51898,"iShares Core MSCI AC Asia ex Japan Index ETF",10,Unit,Unit,NULL
5376,51898,"iShares Core MSCI AC Asia ex Japan Index ETF",10,Unit,Unit,NULL
5294,51818,"iShares Core MSCI China Index ETF",10,Unit,Unit,NULL
31926,51818,"iShares Core MSCI China Index ETF",10,Unit,Unit,NULL
20529,2595795,"iShares Core MSCI Taiwan Index ETF",10,Unit,Unit,NULL
20530,2595795,"iShares Core MSCI Taiwan Index ETF",10,Unit,Unit,NULL
20531,2595795,"iShares Core MSCI Taiwan Index ETF",10,Unit,Unit,NULL
21544,51750,"iShares Core SENSEX India Index ETF",10,Unit,Unit,NULL
21545,51750,"iShares Core SENSEX India Index ETF",10,Unit,Unit,NULL
5282,51750,"iShares Core SENSEX India Index ETF",10,Unit,Unit,NULL
5563,55880,"iShares CSI A-Share Financials Index ETF",10,Unit,Unit,NULL
20532,2595796,"iShares DAX Index ETF",10,Unit,Unit,NULL
20533,2595796,"iShares DAX Index ETF",10,Unit,Unit,NULL
20534,2595796,"iShares DAX Index ETF",10,Unit,Unit,NULL
20535,2595797,"iShares EURO STOXX 50 Index ETF",10,Unit,Unit,NULL
20536,2595797,"iShares EURO STOXX 50 Index ETF",10,Unit,Unit,NULL
20537,2595797,"iShares EURO STOXX 50 Index ETF",10,Unit,Unit,NULL
20538,2595798,"iShares FTSE 100 Index ETF",10,Unit,Unit,NULL
20539,2595798,"iShares FTSE 100 Index ETF",10,Unit,Unit,NULL
20540,2595798,"iShares FTSE 100 Index ETF",10,Unit,Unit,NULL
25065,51813,"iShares FTSE China A50 ETF",10,Unit,Unit,NULL
5289,51813,"iShares FTSE China A50 ETF",10,Unit,Unit,NULL
29691,25125097,"iShares Hang Seng TECH ETF",10,Unit,Unit,NULL
29692,25125097,"iShares Hang Seng TECH ETF",10,Unit,Unit,NULL
18989,2531138,"iShares MSCI China A International Index ETF",10,Unit,Unit,NULL
18990,2531138,"iShares MSCI China A International Index ETF",10,Unit,Unit,NULL
5379,51901,"iShares MSCI Emerging Asia Index ETF",10,Unit,Unit,NULL
29525,24864593,"iShares MSCI Emerging Markets ETF",10,Unit,Unit,NULL
29527,24864593,"iShares MSCI Emerging Markets ETF",10,Unit,Unit,NULL
5737,56481,"iShares MSCI South Korea Capped ETF",10,Unit,Unit,NULL
5738,56482,"iShares MSCI Taiwan ETF",10,Unit,Unit,NULL
20541,2595799,"iShares NASDAQ 100 Index ETF",10,Unit,Unit,NULL
20542,2595799,"iShares NASDAQ 100 Index ETF",10,Unit,Unit,NULL
20543,2595799,"iShares NASDAQ 100 Index ETF",10,Unit,Unit,NULL
32422,27371532,"iShares Short Duration China Policy Bank Bond ETF",10,Unit,Unit,NULL
32423,27371532,"iShares Short Duration China Policy Bank Bond ETF",10,Unit,Unit,NULL
32424,27371532,"iShares Short Duration China Policy Bank Bond ETF",10,Unit,Unit,NULL
25823,11799981,"ISP Global Limited",0,O,"Ordinary shares",NULL
3421,18142,"ISP Holdings Limited (BM)",0,O,"Ordinary shares",NULL
5029,2507,"ITC Properties Group Limited",1,Wrnt,Warrant,2010-02-06
307,2507,"ITC Properties Group Limited",0,O,"Ordinary shares",NULL
2921,13085,"ITE (HOLDINGS) LIMITED",0,O,"Ordinary shares",NULL
28208,7109379,"IVD Medical Holding Limited",0,O,"Ordinary shares",NULL
28440,15059976,"IWS Group Holdings Limited",0,O,"Ordinary shares",NULL
34594,28105583,"J&T Global Express Limited",8,B,B-share,NULL
30247,25385391,"JACOBIO PHARMACEUTICALS GROUP CO., LTD.",0,O,"Ordinary shares",NULL
21176,2552318,"Jacobson Pharma Corporation Limited",0,O,"Ordinary shares",NULL
21442,2549036,"Janco Holdings Limited",0,O,"Ordinary shares",NULL
2695,11949,"Japan Kyosei Group Company Limited",0,O,"Ordinary shares",NULL
27925,17132477,"JBB BUILDERS INTERNATIONAL LIMITED",0,O,"Ordinary shares",NULL
30512,24282008,"JBM (Healthcare) Limited",0,O,"Ordinary shares",NULL
30119,25296105,"JD Health International Inc.",0,O,"Ordinary shares",NULL
34315,25296105,"JD Health International Inc.",0,O,"Ordinary shares",NULL
31184,26431214,"JD Logistics, Inc.",0,O,"Ordinary shares",NULL
34316,22146839,"JD.com, Inc.",7,A,A-share,NULL
26818,22146839,"JD.com, Inc.",7,A,A-share,NULL
33495,26875795,"Jenscare Scientific Co., Ltd.",6,H,H-share,NULL
34088,27092820,"JF SmartInvest Holdings Ltd",0,O,"Ordinary shares",NULL
28062,22459561,"JH Educational Technology INC.",0,O,"Ordinary shares",NULL
12495,2248873,"Jia Yao Holdings Limited",0,O,"Ordinary shares",NULL
28899,12191263,"JiaChen Holding Group Limited",0,O,"Ordinary shares",NULL
2928,13386,"Jiading International Group Holdings Limited",0,O,"Ordinary shares",NULL
4861,39476,"Jiahua Stores Holdings Limited",0,O,"Ordinary shares",NULL
3364,15206,"JIAN EPAYMENT SYSTEMS LIMITED",0,O,"Ordinary shares",NULL
2815,12519,"Jiande International Holdings Limited",0,O,"Ordinary shares",NULL
9244,152790,"Jiangnan Group Limited",0,O,"Ordinary shares",NULL
1106,4881,"Jiangsu Expressway Company Limited",6,H,H-share,NULL
35915,31536907,"Jiangsu Guofu Hydrogen Energy Equipment Co., Ltd.",6,H,H-share,NULL
36240,30220291,"JIANGSU HORIZON CHAIN SUPERMARKET COMPANY LIMITED",6,H,H-share,NULL
26138,12102906,"Jiangsu Innovative Ecological New Materials Limited",0,O,"Ordinary shares",NULL
35863,28826544,"Jiangsu Lopal Tech. Co., Ltd.",6,H,H-share,NULL
2949,13555,"Jiangsu NandaSoft Technology Company Limited",6,H,H-share,NULL
32930,27065184,"Jiangsu Recbio Technology Co., Ltd.",6,H,H-share,NULL
36277,32197045,"Jiangsu Zenergy Battery Technologies Group Co., Ltd.",6,H,H-share,NULL
26591,12617807,"JIANGXI BANK CO., LTD.",6,H,H-share,NULL
1107,4882,"Jiangxi Copper Company Limited",6,H,H-share,NULL
35272,30030616,"Jiangxi Rimag Group Co., Ltd.",6,H,H-share,NULL
29063,24142992,"JIANZHONG CONSTRUCTION DEVELOPMENT LIMITED",0,O,"Ordinary shares",NULL
12774,2275072,"Jiashili Group Limited",0,O,"Ordinary shares",NULL
29430,23979732,"JiaXing Gas Group Co., Ltd.",6,H,H-share,NULL
19130,2449248,"Jiayuan International Group Limited",0,O,"Ordinary shares",NULL
29831,24855630,"Jiayuan Services Holdings Limited",0,O,"Ordinary shares",NULL
22326,2537294,"Jilin Jiutai Rural Commercial Bank Corporation Limited",6,H,H-share,NULL
28437,23332568,"Jilin Province Chuncheng Heating Company Limited",6,H,H-share,NULL
3069,14234,"JILIN PROVINCE HUINAN CHANGLONG BIO-PHARMACY COMPANY LIMITED",6,H,H-share,NULL
4747,34308,"Jilin Qifeng Chemical Fiber Co., Ltd.",6,H,H-share,NULL
20189,2401314,"Jimu Group Limited",0,O,"Ordinary shares",NULL
20854,2481314,"JIN MI FANG GROUP HOLDINGS LIMITED (KY)",0,O,"Ordinary shares",NULL
2951,13614,"Jinchuan Group International Resources Co. Ltd",0,O,"Ordinary shares",NULL
11428,2139296,"JINGRUI HOLDINGS LIMITED",0,O,"Ordinary shares",NULL
1109,1452,"JINGWEI TEXTILE MACHINERY COMPANY LIMITED",6,H,H-share,NULL
25302,12085826,"Jinhai Medical Technology Limited",0,O,"Ordinary shares",NULL
1110,2677,"JINHUI HOLDINGS COMPANY LIMITED",0,O,"Ordinary shares",NULL
29992,24855638,"Jinke Smart Services Group Co., Ltd.",6,H,H-share,NULL
12473,2257909,"Jinmao (China) Hotel Investments and Management Limited",0,O,"Ordinary shares",NULL
32847,25125143,"Jinmao Property Services Co., Limited",0,O,"Ordinary shares",NULL
28219,22870314,"JINSHANG BANK CO., LTD.",6,H,H-share,NULL
4605,27498,"Jintai Energy Holdings Limited",0,O,"Ordinary shares",NULL
28133,22663770,"Jinxin Fertility Group Limited",0,O,"Ordinary shares",NULL
13792,2245256,"Jisheng Group Holdings Limited",0,O,"Ordinary shares",NULL
3616,21651,"Jiu Rong Holdings Limited",0,O,"Ordinary shares",NULL
30656,23024302,"Jiujiuwang Food International Limited",0,O,"Ordinary shares",NULL
28822,23411314,"Jiumaojiu International Holdings Limited",0,O,"Ordinary shares",NULL
16661,2441119,"Jiyi Holdings Limited",0,O,"Ordinary shares",NULL
32721,23412909,"JL MAG RARE-EARTH CO., LTD.",6,H,H-share,NULL
26287,11788627,"JLogo Holdings Limited",0,O,"Ordinary shares",NULL
21637,2601284,"JNBY Design Limited",0,O,"Ordinary shares",NULL
46,632,"JOHNSON ELECTRIC HOLDINGS LIMITED",0,O,"Ordinary shares",NULL
30615,25320623,"JOINN LABORATORIES (CHINA) CO., LTD.",6,H,H-share,NULL
4599,27037,"Jolimark Holdings Limited",0,O,"Ordinary shares",NULL
144,1565,"Joy City Property Limited",0,O,"Ordinary shares",NULL
29679,23316924,"Joy Spreader Group Inc.",0,O,"Ordinary shares",NULL
129,23134043,"Joyce Boutique Group Limited",0,O,"Ordinary shares",NULL
28548,23228065,"JS Global Lifestyle Company Limited",0,O,"Ordinary shares",NULL
25810,2362838,"JTF International Holdings Limited",0,O,"Ordinary shares",NULL
4665,30381,"JU TENG INTERNATIONAL HOLDINGS LIMITED",0,O,"Ordinary shares",NULL
13699,30381,"JU TENG INTERNATIONAL HOLDINGS LIMITED",1,Wrnt,Warrant,2016-10-14
18471,2483242,"JUJIANG CONSTRUCTION GROUP CO., LTD.",6,H,H-share,NULL
28678,2131209,"Justin Allen Holdings Limited",0,O,"Ordinary shares",NULL
4767,36155,"Jutal Offshore Oil Services Limited",0,O,"Ordinary shares",NULL
29881,25015604,"JW (Cayman) Therapeutics Co. Ltd",0,O,"Ordinary shares",NULL
23187,2574820,"JX ENERGY LTD.",0,O,"Ordinary shares",NULL
33597,27322501,"JY GAS LIMITED",0,O,"Ordinary shares",NULL
28718,22522962,"JY Grandmark Holdings Limited",0,O,"Ordinary shares",NULL
1111,4884,"K & P INTERNATIONAL HOLDINGS LIMITED",0,O,"Ordinary shares",NULL
34749,28828142,"K Cash Corporation Limited",0,O,"Ordinary shares",NULL
22093,2538775,"K W Nelson Interior Design and Contracting Group Limited",0,O,"Ordinary shares",NULL
19305,2474094,"K. H. Group Holdings Limited",0,O,"Ordinary shares",NULL
1113,1893,"K. WAH INTERNATIONAL HOLDINGS LIMITED",0,O,"Ordinary shares",NULL
27681,20808146,"K2 F&B Holdings Limited",0,O,"Ordinary shares",NULL
4876,39981,"Ka Shui International Holdings Limited",0,O,"Ordinary shares",NULL
1115,619,"KADER HOLDINGS COMPANY LIMITED",0,O,"Ordinary shares",NULL
20578,2492946,"Kafelaku Coffee Holding Limited",0,O,"Ordinary shares",NULL
