issueID,issuer,name1,typeID,typeShort,typeLong,expmat
25285,10931037,"RMH Holdings Limited",0,O,"Ordinary shares",NULL
1219,4955,"ROAD KING INFRASTRUCTURE LIMITED",0,O,"Ordinary shares",NULL
34901,30884136,"RoboSense Technology Co., Ltd",0,O,"Ordinary shares",NULL
30446,24884448,"Roiserv Lifestyle Services Co., Ltd.",6,H,H-share,NULL
10540,152902,"Roma (meta) Group Limited",0,O,"Ordinary shares",NULL
27899,17470422,"Rongzun International Holdings Group Limited",0,O,"Ordinary shares",NULL
18546,2365876,"Ronshine China Holdings Limited",0,O,"Ordinary shares",NULL
31597,25451552,"Ronshine Service Holding Co., Ltd",0,O,"Ordinary shares",NULL
1032,4824,"Rosan Resources Holdings Limited",0,O,"Ordinary shares",NULL
22469,2578326,"Royal Deluxe Holdings Limited",0,O,"Ordinary shares",NULL
3277,17127,"Royale Home Holdings Limited",0,O,"Ordinary shares",NULL
4875,39970,"RREEF China Commercial Trust",10,Unit,Unit,NULL
6436,62293,"Rui Feng Group Holdings Company Limited",0,O,"Ordinary shares",NULL
35444,26928129,"RUICHANG INTERNATIONAL HOLDINGS LIMITED",0,O,"Ordinary shares",NULL
3346,15207,"Ruifeng Petroleum Chemical Holdings Limited",0,O,"Ordinary shares",NULL
25688,12049665,"Ruifeng Power Group Company Limited",0,O,"Ordinary shares",NULL
28688,22658502,"Ruihe Data Technology Holdings Limited (KY)",0,O,"Ordinary shares",NULL
28566,23405769,"Ruisen Life Service Co, Limited (KY)",0,O,"Ordinary shares",NULL
2517,10865,"Ruixin International Holdings Limited",0,O,"Ordinary shares",NULL
4950,10865,"Ruixin International Holdings Limited",1,Wrnt,Warrant,2010-01-02
33987,26813984,"Runhua Living Service Group Holdings Limited",0,O,"Ordinary shares",NULL
5159,50500,"Rykadan Capital Limited",0,O,"Ordinary shares",NULL
3829,2165,"S E A HOLDINGS LIMITED",1,Wrnt,Warrant,2008-12-03
1226,2165,"S E A HOLDINGS LIMITED",0,O,"Ordinary shares",NULL
25066,8054021,"S&P International Holding Limited",0,O,"Ordinary shares",NULL
25699,2670986,"S&S Intervalue China Limited",0,O,"Ordinary shares",NULL
27220,13494639,"S-Enjoy Service Group Co., Limited",0,O,"Ordinary shares",NULL
27933,22501152,"S.A.I. Leisure Group Company Limited",0,O,"Ordinary shares",NULL
1221,4956,"S.A.S. Dragon Holdings Limited",0,O,"Ordinary shares",NULL
35950,14188047,"S.F. Holding Co., Ltd.",6,H,H-share,NULL
1222,2087,"SA SA INTERNATIONAL HOLDINGS LIMITED",0,O,"Ordinary shares",NULL
250,1162,"SAFETY GODOWN COMPANY, LIMITED",0,O,"Ordinary shares",NULL
12832,2021977,"Sam Woo Construction Group Limited",0,O,"Ordinary shares",NULL
4826,38361,"Samling Global Limited",0,O,"Ordinary shares",NULL
4667,30458,"Samson Holding Ltd.",0,O,"Ordinary shares",NULL
6940,66471,"Samsonite Group S.A.",0,O,"Ordinary shares",NULL
33171,28432297,"Samsung Asia Pacific ex NZ Metaverse Theme ETF",10,Unit,Unit,NULL
33994,28823978,"Samsung Bitcoin Futures Active ETF",10,Unit,Unit,NULL
33148,28398979,"Samsung Blockchain Technologies ETF",10,Unit,Unit,NULL
32445,27399212,"Samsung Bloomberg Global Semiconductor ETF",10,Unit,Unit,NULL
26579,17139801,"Samsung CSI China Dragon Internet ETF",10,Unit,Unit,NULL
29282,17139801,"Samsung CSI China Dragon Internet ETF",10,Unit,Unit,NULL
23468,2708738,"Samsung HSCEI Daily (-1x) Inverse Product",10,Unit,Unit,NULL
23469,2708739,"Samsung HSCEI Daily (2x) Leveraged Product",10,Unit,Unit,NULL
23470,2708740,"Samsung HSI Daily (-1x) Inverse Product",10,Unit,Unit,NULL
23471,2708741,"Samsung HSI Daily (2x) Leveraged Product",10,Unit,Unit,NULL
13492,2380387,"Samsung HSI Futures ETF",10,Unit,Unit,NULL
13491,2380386,"Samsung HSI Futures RMB FX ETF",10,Unit,Unit,NULL
20389,2588900,"Samsung KOSPI 200 Daily (-1x) Inverse Product",10,Unit,Unit,NULL
20388,2588898,"Samsung KOSPI 200 Daily (2x) Leveraged Product",10,Unit,Unit,NULL
31161,26742245,"Samsung NYSE FANG+ ETF",10,Unit,Unit,NULL
31162,26742245,"Samsung NYSE FANG+ ETF",10,Unit,Unit,NULL
19887,2567441,"Samsung S&P GSCI Crude Oil ER Futures ETF",10,Unit,Unit,NULL
29820,25258034,"Samsung S&P High Dividend APAC ex NZ REITs ETF",10,Unit,Unit,NULL
29821,25258034,"Samsung S&P High Dividend APAC ex NZ REITs ETF",10,Unit,Unit,NULL
20391,2588902,"Samsung TOPIX Daily (-1x) Inverse Product",10,Unit,Unit,NULL
20390,2588901,"Samsung TOPIX Daily (2x) Leveraged Product",10,Unit,Unit,NULL
1225,637,"SAN MIGUEL BREWERY HONG KONG LIMITED",0,O,"Ordinary shares",NULL
4812,38014,"Sanai Health Industry Group Company Limited",0,O,"Ordinary shares",NULL
25681,12070718,"Sanbase Corporation Limited",0,O,"Ordinary shares",NULL
4575,25466,"SANDMARTIN INTERNATIONAL HOLDINGS LIMITED",0,O,"Ordinary shares",NULL
5503,54444,"Sands China Ltd.",0,O,"Ordinary shares",NULL
33993,25613085,"Sanergy Group Limited",0,O,"Ordinary shares",NULL
29055,22014563,"Sang Hing Holdings (International) Limited",0,O,"Ordinary shares",NULL
3614,21622,"Sanmenxia Tianyuan Aluminum Company Limited",6,H,H-share,NULL
11100,1934055,"Sansheng Holdings (Group) Co. Ltd.",0,O,"Ordinary shares",NULL
28819,22162183,"SANVO Fine Chemicals Group Limited",0,O,"Ordinary shares",NULL
31539,23714352,"Sanxun Holdings Group Limited",0,O,"Ordinary shares",NULL
5484,54074,"Sany Heavy Equipment International Holdings Company Limited",0,O,"Ordinary shares",NULL
1119,4890,"SANYUAN GROUP LIMITED",0,O,"Ordinary shares",NULL
25299,11208517,"Satu Holdings Limited (KY)",0,O,"Ordinary shares",NULL
3371,18159,"SAU SAN TONG HOLDINGS LIMITED",0,O,"Ordinary shares",NULL
6778,65279,"SBI Holdings, Inc.",42,HDRO,"HK Depository Receipt Ordinary",NULL
31367,25705976,"SCE Intelligent Commercial Management Holdings Limited",0,O,"Ordinary shares",NULL
28126,22977961,"Scholar Education Group",0,O,"Ordinary shares",NULL
5552,55697,"SCHRAMM HOLDING AG",0,O,"Ordinary shares",NULL
30635,24878125,"SciClone Pharmaceuticals (Holdings) Limited",0,O,"Ordinary shares",NULL
12835,2257522,"SDM Education Group Holdings Limited",0,O,"Ordinary shares",NULL
34110,27928573,"Seacon Shipping Group Holdings Limited",0,O,"Ordinary shares",NULL
3010,14237,"Seamless Green China (Holdings) Limited",0,O,"Ordinary shares",NULL
10144,152350,"SEAZEN GROUP LIMITED",0,O,"Ordinary shares",NULL
1246,4971,"SEEC MEDIA GROUP LIMITED",0,O,"Ordinary shares",NULL
28985,2535714,"SEM Holdings Limited (KY)",0,O,"Ordinary shares",NULL
3507,20438,"SEMICONDUCTOR MANUFACTURING INTERNATIONAL CORPORATION",0,O,"Ordinary shares",NULL
32630,27350043,"SenseTime Group Inc.",8,B,B-share,NULL
34305,27350043,"SenseTime Group Inc.",8,B,B-share,NULL
31054,26685156,"SF Real Estate Investment Trust",10,Unit,Unit,NULL
4958,42406,"SFK Construction Holdings Limited",0,O,"Ordinary shares",NULL
12567,2252934,"SFund International Holdings Limited",0,O,"Ordinary shares",NULL
23197,2612146,"SG Group Holdings Limited",0,O,"Ordinary shares",NULL
22196,2607408,"SH Group (Holdings) Limited",0,O,"Ordinary shares",NULL
3401,18171,"SHAANXI NORTHWEST NEW TECHNOLOGY INDUSTRY COMPANY LIMITED",6,H,H-share,NULL
33883,28105589,"Shandong Boan Biotechnology Co., Ltd.",6,H,H-share,NULL
4992,41095,"Shandong Chenming Paper Holdings Limited",6,H,H-share,NULL
29434,23573976,"Shandong Fengxiang Co., Ltd.",6,H,H-share,NULL
26868,2426833,"Shandong Gold Mining Co., Ltd.",6,H,H-share,NULL
1030,4822,"SHANDONG HI-SPEED HOLDINGS GROUP LIMITED",0,O,"Ordinary shares",NULL
4972,4822,"SHANDONG HI-SPEED HOLDINGS GROUP LIMITED",1,Wrnt,Warrant,2009-06-30
7145,4822,"SHANDONG HI-SPEED HOLDINGS GROUP LIMITED",1,Wrnt,Warrant,2013-10-25
10981,2021601,"Shandong Hi-Speed New Energy Group Limited",0,O,"Ordinary shares",NULL
25490,2641821,"Shandong International Trust Co., Ltd.",6,H,H-share,NULL
4678,30864,"SHANDONG LUOXIN PHARMACEUTICAL GROUP STOCK CO., LTD.",6,H,H-share,NULL
3550,20774,"SHANDONG MOLONG PETROLEUM MACHINERY COMPANY LIMITED",6,H,H-share,NULL
3485,19738,"Shandong Weigao Group Medical Polymer Company Limited",6,H,H-share,NULL
1230,4959,"Shandong Xinhua Pharmaceutical Company Limited",6,H,H-share,NULL
32509,25712211,"Shanghai Bio-heart Biological Technology Co., Ltd.",6,H,H-share,NULL
33840,27751511,"Shanghai Chicmax Cosmetic Co., Ltd.",6,H,H-share,NULL
32598,26509987,"Shanghai Conant Optical Co., Ltd.",6,H,H-share,NULL
4606,27505,"Shanghai Dasheng Agriculture Finance Technology Co., Ltd.",6,H,H-share,NULL
14121,49233,"Shanghai Dazhong Public Utilities (Group) Co., Ltd.",6,H,H-share,NULL
27782,22381275,"Shanghai Dongzheng Automotive Finance Co., Ltd.",6,H,H-share,NULL
4571,25130,"Shanghai Electric Group Company Limited",6,H,H-share,NULL
3441,18210,"SHANGHAI FORTE LAND CO., LTD.",6,H,H-share,NULL
9924,1849011,"Shanghai Fosun Pharmaceutical (Group) Co., Ltd.",6,H,H-share,NULL
2632,11503,"Shanghai Fudan Microelectronics Group Company Limited",6,H,H-share,NULL
3388,16187,"SHANGHAI FUDAN-ZHANGJIANG BIO-PHARMACEUTICAL CO., LIMITED",6,H,H-share,NULL
28871,22595350,"Shanghai Gench Education Group Limited",0,O,"Ordinary shares",NULL
13776,2354634,"Shanghai Haohai Biological Technology Co., Ltd.",6,H,H-share,NULL
31891,25698986,"Shanghai HeartCare Medical Technology Corporation Limited",6,H,H-share,NULL
28366,15059974,"Shanghai Henlius Biotech, Inc.",6,H,H-share,NULL
352,441,"SHANGHAI INDUSTRIAL HOLDINGS LIMITED",0,O,"Ordinary shares",NULL
1296,5004,"Shanghai Industrial Urban Development Group Limited",0,O,"Ordinary shares",NULL
28580,23322364,"Shanghai INT Medical Instruments Co., Ltd.",6,H,H-share,NULL
1232,4961,"SHANGHAI INTERNATIONAL SHANGHAI GROWTH INVESTMENT LIMITED",0,O,"Ordinary shares",NULL
3380,16731,"Shanghai Jiaoda Withub Information Industrial Company Limited",6,H,H-share,NULL
4793,37085,"Shanghai Jin Jiang Capital Company Limited",6,H,H-share,NULL
27413,19379626,"Shanghai Junshi Biosciences Co., Ltd.",6,H,H-share,NULL
32433,26928719,"Shanghai MicroPort MedBot (Group) Co., Ltd.",6,H,H-share,NULL
6836,65788,"Shanghai Pharmaceuticals Holding Co., Ltd.",6,H,H-share,NULL
11433,2118596,"Shanghai Pioneer Holding Ltd",0,O,"Ordinary shares",NULL
4731,34208,"Shanghai Prime Machinery Company Limited",6,H,H-share,NULL
3611,21439,"SHANGHAI QINGPU FIRE-FIGHTING EQUIPMENT CO., LTD.",6,H,H-share,NULL
27237,11796728,"Shanghai Realway Capital Assets Management Co., Ltd.",6,H,H-share,NULL
35993,31317186,"Shanghai REFIRE Group Limited",6,H,H-share,NULL
7097,68421,"Shanghai XNG Holdings Limited",0,O,"Ordinary shares",NULL
101,806,"SHANGRI-LA ASIA LIMITED",0,O,"Ordinary shares",NULL
26576,2669559,"Shanshan Brand Management Co., Ltd.",6,H,H-share,NULL
3592,21068,"SHANXI CHANGCHENG MICROLIGHT EQUIPMENT CO. LTD.",6,H,H-share,NULL
34718,28139885,"Shanxi Installation Group Co., Ltd.",6,H,H-share,NULL
15949,2308892,"Shanyu Group Holdings Company Limited",0,O,"Ordinary shares",NULL
5600,56158,"Shaw Brothers Holdings Limited",0,O,"Ordinary shares",NULL
9629,1899963,"SHEEN TAI HOLDINGS GROUP COMPANY LIMITED",0,O,"Ordinary shares",NULL
26604,12108036,"Sheng Tang Holdings Limited (KY)",0,O,"Ordinary shares",NULL
1884,7340,"Sheng Yuan Holdings Limited",0,O,"Ordinary shares",NULL
3350,15430,"Shenghua Lande Scitech Limited",6,H,H-share,NULL
34748,25705992,"Shenghui Cleanness Group Holdings Limited",0,O,"Ordinary shares",NULL
13116,2286631,"Shengjing Bank Co., Ltd.",6,H,H-share,NULL
5539,55489,"Shengli Oil & Gas Pipe Holdings Limited",0,O,"Ordinary shares",NULL
25073,2641350,"SHENGLONG SPLENDECOR INTERNATIONAL LIMITED",0,O,"Ordinary shares",NULL
5435,52005,"Shenguan Holdings (Group) Limited",0,O,"Ordinary shares",NULL
1123,4893,"SHENJI GROUP KUNMING MACHINE TOOL COMPANY LIMITED",6,H,H-share,NULL
3373,16959,"Shentong Robot Education Group Company Limited",0,O,"Ordinary shares",NULL
465,3481,"SHENWAN HONGYUAN (H.K.) LIMITED",0,O,"Ordinary shares",NULL
27897,19600,"Shenwan Hongyuan Group Co., Ltd.",6,H,H-share,NULL
2343,9726,"Shenyang Public Utility Holdings Company Limited",6,H,H-share,NULL
36023,32013430,"SHENZHEN DOBOT CORP LTD",6,H,H-share,NULL
1235,4964,"Shenzhen Expressway Corporation Limited",6,H,H-share,NULL
29396,24059273,"SHENZHEN HEPALINK PHARMACEUTICAL GROUP CO., LTD.",6,H,H-share,NULL
1236,4965,"SHENZHEN INTERNATIONAL HOLDINGS LIMITED",0,O,"Ordinary shares",NULL
9990,18199,"Shenzhen Investment Holdings Bay Area Development Company Limited",0,O,"Ordinary shares",NULL
3428,18199,"Shenzhen Investment Holdings Bay Area Development Company Limited",0,O,"Ordinary shares",NULL
1239,2891,"SHENZHEN INVESTMENT LIMITED",0,O,"Ordinary shares",NULL
3613,21605,"SHENZHEN MINGWAH AOHAN HIGH TECHNOLOGY CORPORATION LIMITED",6,H,H-share,NULL
4626,29420,"Shenzhen Neptunus Interlong Bio-technique Company Limited",6,H,H-share,NULL
33986,24613197,"Shenzhen Pagoda Industrial (Group) Corporation Limited",6,H,H-share,NULL
4670,30659,"Shenzhou International Group Holdings Limited",0,O,"Ordinary shares",NULL
2392,9866,"Shenzhou Space Park Group Limited",0,O,"Ordinary shares",NULL
25937,11787067,"Sheung Moon Holdings Limited",0,O,"Ordinary shares",NULL
21768,2572535,"Sheung Yue Group Holdings Limited",0,O,"Ordinary shares",NULL
6438,62369,"ShiFang Holding Limited",0,O,"Ordinary shares",NULL
4750,34885,"Shimao Group Holdings Limited",0,O,"Ordinary shares",NULL
29816,24035331,"Shimao Services Holdings Limited",0,O,"Ordinary shares",NULL
3458,16166,"Shin Hwa World Limited",0,O,"Ordinary shares",NULL
28135,23201234,"Shinelong Automotive Lightweight Application Limited",0,O,"Ordinary shares",NULL
26593,12655177,"Shineroad International Holdings Limited",0,O,"Ordinary shares",NULL
26953,12758228,"Shing Chi Holdings Limited",0,O,"Ordinary shares",NULL
29978,24716280,"Shinsun Holdings (Group) Co., Ltd.",0,O,"Ordinary shares",NULL
6054,58844,"SHIRBLE DEPARTMENT STORE HOLDINGS (CHINA) LIMITED",0,O,"Ordinary shares",NULL
34568,28976544,"Shiyue Daotian Group Co., Ltd.",6,H,H-share,NULL
5089,793,"SHK Hong Kong Industries Limited",1,Wrnt,Warrant,2011-04-21
5014,793,"SHK Hong Kong Industries Limited",1,Wrnt,Warrant,2009-05-28
1328,793,"SHK Hong Kong Industries Limited",0,O,"Ordinary shares",NULL
438,767,"Shoucheng Holdings Limited (b1985-09-10)",0,O,"Ordinary shares",NULL
446,3377,"Shougang Century Holdings Limited",0,O,"Ordinary shares",NULL
455,3356,"SHOUGANG FUSHAN RESOURCES GROUP LIMITED",0,O,"Ordinary shares",NULL
25398,12049669,"Shuang Yun Holdings Limited",0,O,"Ordinary shares",NULL
6964,66759,"Shuanghua Holdings Limited",0,O,"Ordinary shares",NULL
4772,22866,"SHUI ON LAND LIMITED",0,O,"Ordinary shares",NULL
1240,3707,"SHUN HO HOLDINGS LIMITED",0,O,"Ordinary shares",NULL
635,3703,"SHUN HO PROPERTY INVESTMENTS LIMITED",0,O,"Ordinary shares",NULL
85,454,"SHUN TAK HOLDINGS LIMITED",0,O,"Ordinary shares",NULL
21194,2588846,"Shun Wo Group Holdings Limited",0,O,"Ordinary shares",NULL
7022,67281,"Shunfeng International Clean Energy Limited",0,O,"Ordinary shares",NULL
11281,1873172,"Shunten International (Holdings) Limited",0,O,"Ordinary shares",NULL
3313,17610,"Shuoao International Holdings Limited (KY)",0,O,"Ordinary shares",NULL
35146,30461017,"Sichuan Baicha Baidao Industrial Co., Ltd.",6,H,H-share,NULL
27418,12803615,"Sichuan Energy Investment Development Co., Ltd.",6,H,H-share,NULL
1241,4967,"SICHUAN EXPRESSWAY COMPANY LIMITED",6,H,H-share,NULL
34418,28837160,"Sichuan Kelun-Biotech Biopharmaceutical Co., Ltd.",6,H,H-share,NULL
28463,22599018,"Sichuan Languang Justbon Services Group Co., Ltd.",6,H,H-share,NULL
6318,61376,"Sihuan Pharmaceutical Holdings Group Ltd.",0,O,"Ordinary shares",NULL
9521,1909346,"SIIC ENVIRONMENT HOLDINGS LTD.",0,O,"Ordinary shares",NULL
369,1449,"Silk Road Logistics Holdings Limited",0,O,"Ordinary shares",NULL
4646,29885,"Silkwave Inc",0,O,"Ordinary shares",NULL
5083,48604,"Silver Base Group Holdings Limited",0,O,"Ordinary shares",NULL
1243,4969,"Silver Grant International Holdings Group Limited",0,O,"Ordinary shares",NULL
4602,27102,"SIM TECHNOLOGY GROUP LIMITED",0,O,"Ordinary shares",NULL
7129,47255,"Simcere Pharmaceutical Group Limited",0,O,"Ordinary shares",NULL
25958,7540686,"Simplicity Holding Limited",0,O,"Ordinary shares",NULL
121,976,"SINCERE COMPANY, LIMITED (THE)",0,O,"Ordinary shares",NULL
4651,30006,"Sincere Watch (Hong Kong) Limited",0,O,"Ordinary shares",NULL
19173,2429688,"Sinco Pharmaceuticals Holdings Limited",0,O,"Ordinary shares",NULL
3086,14238,"SING LEE SOFTWARE (GROUP) LIMITED",0,O,"Ordinary shares",NULL
2498,10669,"Sing Pao Media Enterprises Limited",0,O,"Ordinary shares",NULL
1191,4943,"SING TAO NEWS CORPORATION LIMITED",0,O,"Ordinary shares",NULL
462,3462,"SINGAMAS CONTAINER HOLDINGS LIMITED",0,O,"Ordinary shares",NULL
20678,2517206,"SingAsia Holdings Limited",0,O,"Ordinary shares",NULL
28596,22479212,"Sinic Holdings (Group) Company Limited",0,O,"Ordinary shares",NULL
2821,12538,"SINO BIOPHARMACEUTICAL LIMITED",0,O,"Ordinary shares",NULL
7098,68532,"Sino Energy International Holdings Group Limited",0,O,"Ordinary shares",NULL
27449,16054891,"Sino Gas Holdings Group Limited",0,O,"Ordinary shares",NULL
4828,38519,"Sino Gold Mining Limited",0,O,"Ordinary shares",NULL
2830,12563,"SINO GOLF HOLDINGS LIMITED",0,O,"Ordinary shares",NULL
7026,67331,"Sino Harbour Holdings Group Limited",0,O,"Ordinary shares",NULL
1247,663,"SINO HOTELS (HOLDINGS) LIMITED",0,O,"Ordinary shares",NULL
2668,11810,"Sino ICT Holdings Limited",0,O,"Ordinary shares",NULL
39,664,"SINO LAND COMPANY LIMITED",0,O,"Ordinary shares",NULL
2553,11018,"SINO OIL AND GAS HOLDINGS LIMITED",0,O,"Ordinary shares",NULL
3456,15884,"Sino Prosper (Group) Holdings Limited",0,O,"Ordinary shares",NULL
2465,10220,"Sino Splendid Holdings Limited",0,O,"Ordinary shares",NULL
2579,11205,"Sino Vision Worldwide Holdings Limited",0,O,"Ordinary shares",NULL
29436,22983282,"Sino-Entertainment Technology Holdings Limited",0,O,"Ordinary shares",NULL
245,2133,"SINO-I TECHNOLOGY LIMITED",0,O,"Ordinary shares",NULL
5219,51316,"Sino-Life Group Limited",0,O,"Ordinary shares",NULL
4902,41076,"SINO-OCEAN GROUP HOLDING LIMITED",0,O,"Ordinary shares",NULL
30075,24583302,"Sino-Ocean Service Holding Limited",0,O,"Ordinary shares",NULL
34755,28758122,"Sino-Synergy Hydrogen Energy Technology (Jiaxing) Co., Ltd.",6,H,H-share,NULL
299,1455,"Sinofert Holdings Limited",0,O,"Ordinary shares",NULL
3024,14550,"Sinofortune Financial Holdings Limited",0,O,"Ordinary shares",NULL
33240,26982913,"Sinohealth Holdings Limited",0,O,"Ordinary shares",NULL
21876,2502705,"Sinohope Technology Holdings Limited",0,O,"Ordinary shares",NULL
1414,5610,"SINOLINK WORLDWIDE HOLDINGS LIMITED",0,O,"Ordinary shares",NULL
28609,903553,"SINOMAB BIOSCIENCE LIMITED",0,O,"Ordinary shares",NULL
12570,1936642,"Sinomax Group Limited",0,O,"Ordinary shares",NULL
4996,45874,"SinoMedia Holding Limited",0,O,"Ordinary shares",NULL
10815,1979178,"SINOPEC Engineering (Group) Co., Ltd.",6,H,H-share,NULL
2304,9486,"SINOPEC KANTONS HOLDINGS LIMITED",0,O,"Ordinary shares",NULL
1326,5023,"Sinopec Oilfield Service Corporation",6,H,H-share,NULL
1233,4962,"SINOPEC SHANGHAI PETROCHEMICAL COMPANY LIMITED",6,H,H-share,NULL
5221,51404,"SINOPHARM GROUP CO. LTD.",6,H,H-share,NULL
4786,16957,"Sinopharm Tech Holdings Limited",1,Wrnt,Warrant,2008-11-02
3329,16957,"Sinopharm Tech Holdings Limited",0,O,"Ordinary shares",NULL
10990,153371,"Sinosoft Technology Group Limited",0,O,"Ordinary shares",NULL
3443,18212,"SINOTRANS LIMITED",6,H,H-share,NULL
4933,41647,"SINOTRUK (HONG KONG) LIMITED",0,O,"Ordinary shares",NULL
33836,26955860,"Sipai Health Technology Co., Ltd.",0,O,"Ordinary shares",NULL
32684,27064770,"Sirnaomics Ltd.",0,O,"Ordinary shares",NULL
107,1170,"SIS INTERNATIONAL HOLDINGS LIMITED",0,O,"Ordinary shares",NULL
13326,2333540,"SiS Mobile Holdings Limited",0,O,"Ordinary shares",NULL
25208,2642464,"SISRAM MEDICAL LTD",0,O,"Ordinary shares",NULL
6190,60833,"SITC International Holdings Company Limited",0,O,"Ordinary shares",NULL
7181,133970,"SITOY GROUP HOLDINGS LIMITED",0,O,"Ordinary shares",NULL
4997,45905,"SJM Holdings Limited",0,O,"Ordinary shares",NULL
230,1978,"Sky Blue 11 Company Limited",0,O,"Ordinary shares",NULL
1065,1070,"SKY CHINAFORTUNE HOLDINGS GROUP LIMITED",0,O,"Ordinary shares",NULL
14282,2205282,"SKY LIGHT HOLDINGS LIMITED",0,O,"Ordinary shares",NULL
172,1670,"Skyfame Realty (Holdings) Limited",0,O,"Ordinary shares",NULL
4762,1670,"Skyfame Realty (Holdings) Limited",1,Wrnt,Warrant,2008-08-02
29721,23434844,"Skymission Group Holdings Limited",0,O,"Ordinary shares",NULL
2762,11642,"Skyworth Group Limited",0,O,"Ordinary shares",NULL
25812,2708172,"Sling Group Holdings Limited",0,O,"Ordinary shares",NULL
13228,2309995,"Smart City Development Holdings Limited (KY)",0,O,"Ordinary shares",NULL
1351,5104,"Smart Digital Technology Group Limited",0,O,"Ordinary shares",NULL
25647,11550564,"Smart Globe Holdings Limited",0,O,"Ordinary shares",NULL
21346,2551229,"Smart-Core Holdings Limited",0,O,"Ordinary shares",NULL
3449,17107,"Smartac International Holdings Limited",0,O,"Ordinary shares",NULL
841,486,"SMARTONE TELECOMMUNICATIONS HOLDINGS LIMITED",0,O,"Ordinary shares",NULL
29062,22663778,"SMC Electric Limited",0,O,"Ordinary shares",NULL
3612,21462,"SMI Culture & Travel Group Holdings Limited",0,O,"Ordinary shares",NULL
1024,4818,"SMI Holdings Group Limited",0,O,"Ordinary shares",NULL
19409,2495135,"SMIT Holdings Limited",0,O,"Ordinary shares",NULL
29408,23847428,"Smoore International Holdings Limited",0,O,"Ordinary shares",NULL
28454,15212177,"Snack Empire Holdings Limited",0,O,"Ordinary shares",NULL
1238,4966,"SOCAM Development Limited",0,O,"Ordinary shares",NULL
36232,31857500,"Soft International Group Ltd",0,O,"Ordinary shares",NULL
983,4789,"SoftMedx Healthcare Limited",0,O,"Ordinary shares",NULL
4905,41126,"SOHO CHINA LIMITED",0,O,"Ordinary shares",NULL
4962,42448,"Solargiga Energy Holdings Limited",0,O,"Ordinary shares",NULL
424,3251,"SOLARTECH INTERNATIONAL HOLDINGS LIMITED",0,O,"Ordinary shares",NULL
25485,11787066,"Solis Holdings Limited (KY)",0,O,"Ordinary shares",NULL
3544,20714,"Solomon Systech (International) Limited",0,O,"Ordinary shares",NULL
23639,2579682,"Somerley Capital Holdings Limited",0,O,"Ordinary shares",NULL
6047,58743,"SOUND GLOBAL LTD.",0,O,"Ordinary shares",NULL
413,3184,"SOUNDWILL HOLDINGS LIMITED",0,O,"Ordinary shares",NULL
3354,16094,"South China Assets Holdings Limited",0,O,"Ordinary shares",NULL
1250,938,"South China Financial Holdings Limited",0,O,"Ordinary shares",NULL
4923,938,"South China Financial Holdings Limited",1,Wrnt,Warrant,2008-10-22
5011,927,"South China Holdings Company Limited",1,Wrnt,Warrant,2010-09-06
66,927,"South China Holdings Company Limited",0,O,"Ordinary shares",NULL
31591,25690937,"South China Vocational Education Group Company Limited",0,O,"Ordinary shares",NULL
6379,61871,"South Manganese Investment Limited",0,O,"Ordinary shares",NULL
1016,4811,"South Shore Holdings Limited",0,O,"Ordinary shares",NULL
1251,4974,"SOUTHEAST ASIA PROPERTIES & FINANCE LIMITED",0,O,"Ordinary shares",NULL
20637,2570226,"Southern Energy Holdings Group Limited",0,O,"Ordinary shares",NULL
5591,56082,"SOUTHGOBI RESOURCES LTD.",0,O,"Ordinary shares",NULL
3289,15211,"Southwest Securities International Securities Limited",0,O,"Ordinary shares",NULL
25758,11208515,"Space Group Holdings Limited",0,O,"Ordinary shares",NULL
6175,60749,"SPDR FTSE Greater China ETF",10,Unit,Unit,NULL
5272,51740,"SPDR Gold Trust",10,Unit,Unit,NULL
35838,51740,"SPDR Gold Trust",10,Unit,Unit,NULL
35839,51740,"SPDR Gold Trust",10,Unit,Unit,NULL
10369,1849979,"SPEEDY GLOBAL HOLDINGS LIMITED",0,O,"Ordinary shares",NULL
11559,2169076,"Spring Real Estate Investment Trust",10,Unit,Unit,NULL
6291,61269,"Springland International Holdings Limited",0,O,"Ordinary shares",NULL
28593,22248734,"Sprocomm Intelligence Limited",0,O,"Ordinary shares",NULL
7285,135009,"SPT Energy Group Inc.",0,O,"Ordinary shares",NULL
2366,9772,"SRE Group Limited",0,O,"Ordinary shares",NULL
29125,24379881,"SSIF DCE Iron Ore Futures Index ETF",10,Unit,Unit,NULL
29126,24379881,"SSIF DCE Iron Ore Futures Index ETF",10,Unit,Unit,NULL
4683,31005,"SSY Group Limited (KY)",0,O,"Ordinary shares",NULL
3448,824,"STANDARD CHARTERED PLC",0,O,"Ordinary shares",NULL
22274,2546053,"Standard Development Group Limited",0,O,"Ordinary shares",NULL
33854,26900617,"STAR CM Holdings Limited",0,O,"Ordinary shares",NULL
20646,2576920,"Star Group Asia Limited",0,O,"Ordinary shares",NULL
34325,25691470,"Star Plus Legend Holdings Limited",0,O,"Ordinary shares",NULL
30409,24376601,"STAR SHINE HOLDINGS GROUP LIMITED",0,O,"Ordinary shares",NULL
13707,48313,"Starbucks Corporation",0,O,"Ordinary shares",NULL
3319,17774,"StarGlory Holdings Company Limited",0,O,"Ordinary shares",NULL
27708,20873889,"Starjoy Wellness and Travel Company Limited",0,O,"Ordinary shares",NULL
1252,4975,"STARLITE HOLDINGS LIMITED",0,O,"Ordinary shares",NULL
13501,2143258,"Steed Oriental (Holdings) Company Limited",0,O,"Ordinary shares",NULL
4881,40105,"Stella International Holdings Limited",0,O,"Ordinary shares",NULL
1253,4976,"STELUX HOLDINGS INTERNATIONAL LIMITED",0,O,"Ordinary shares",NULL
26950,11660013,"Sterling Group Holdings Limited (KY)",0,O,"Ordinary shares",NULL
26622,2684530,"STEVE LEUNG DESIGN GROUP LIMITED",0,O,"Ordinary shares",NULL
1255,837,"STONE GROUP HOLDINGS LIMITED",0,O,"Ordinary shares",NULL
30432,24878130,"Strawbear Entertainment Group",0,O,"Ordinary shares",NULL
26130,12110758,"Stream Ideas Group Limited",0,O,"Ordinary shares",NULL
5056,47336,"Strong Petrochemical Holdings Limited",0,O,"Ordinary shares",NULL
22197,4978,"STYLAND HOLDINGS LIMITED",1,Wrnt,Warrant,2018-02-13
1256,4978,"STYLAND HOLDINGS LIMITED",0,O,"Ordinary shares",NULL
11734,4978,"STYLAND HOLDINGS LIMITED",1,Wrnt,Warrant,2015-08-19
15271,4978,"STYLAND HOLDINGS LIMITED",1,Wrnt,Warrant,2016-11-04
26852,4978,"STYLAND HOLDINGS LIMITED",1,Wrnt,Warrant,2019-11-05
28317,4978,"STYLAND HOLDINGS LIMITED",1,Wrnt,Warrant,2020-11-17
30420,4978,"STYLAND HOLDINGS LIMITED",1,Wrnt,Warrant,2022-02-16
34513,4978,"STYLAND HOLDINGS LIMITED",1,Wrnt,Warrant,2024-10-04
1094,4870,"Success Dragon International Holdings Limited",0,O,"Ordinary shares",NULL
1346,2924,"SUCCESS UNIVERSE GROUP LIMITED",0,O,"Ordinary shares",NULL
13615,2164144,"Suchuang Gas Corporation Limited",0,O,"Ordinary shares",NULL
3222,16397,"SUGA INTERNATIONAL HOLDINGS LIMITED",0,O,"Ordinary shares",NULL
