issueID,issuer,name1,typeID,typeShort,typeLong,expmat
26870,16830851,"CHINA RENAISSANCE HOLDINGS LIMITED",0,O,"Ordinary shares",NULL
5093,4656,"China Renewable Energy Investment Limited",1,Wrnt,Warrant,2011-05-13
6023,4656,"China Renewable Energy Investment Limited",1,Wrnt,Warrant,2011-06-08
919,4656,"China Renewable Energy Investment Limited",0,O,"Ordinary shares",NULL
24707,4656,"China Renewable Energy Investment Limited",1,Wrnt,Warrant,2018-05-18
201,1834,"China Resources and Transportation Group Limited",0,O,"Ordinary shares",NULL
349,1108,"China Resources Beer (Holdings) Company Limited",0,O,"Ordinary shares",NULL
34307,1108,"China Resources Beer (Holdings) Company Limited",0,O,"Ordinary shares",NULL
35822,31950574,"China Resources Beverage (Holdings) Company Limited",0,O,"Ordinary shares",NULL
3433,18203,"China Resources Building Materials Technology Holdings Limited",0,O,"Ordinary shares",NULL
1140,2570,"China Resources Gas Group Limited",0,O,"Ordinary shares",NULL
995,2568,"CHINA RESOURCES LAND LIMITED",0,O,"Ordinary shares",NULL
11547,2144393,"China Resources Medical Holdings Company Limited",0,O,"Ordinary shares",NULL
3608,21375,"China Resources Microelectronics Limited",0,O,"Ordinary shares",NULL
30072,24953429,"China Resources Mixc Lifestyle Services Limited",0,O,"Ordinary shares",NULL
21603,1278465,"CHINA RESOURCES PHARMACEUTICAL GROUP LIMITED",0,O,"Ordinary shares",NULL
3415,18184,"CHINA RESOURCES POWER HOLDINGS COMPANY LIMITED",0,O,"Ordinary shares",NULL
27707,133973,"China Risun Group Limited (KY)",0,O,"Ordinary shares",NULL
18904,2449667,"China Rongzhong Financial Holdings Company Limited",0,O,"Ordinary shares",NULL
4746,34307,"China Ruifeng Renewable Energy Holdings Limited",0,O,"Ordinary shares",NULL
12700,2205631,"China Rundong Auto Group Limited",0,O,"Ordinary shares",NULL
13393,4918,"China Ruyi Holdings Limited",1,Wrnt,Warrant,2017-02-23
1154,4918,"China Ruyi Holdings Limited",0,O,"Ordinary shares",NULL
29406,23263454,"China Saftower International Holding Group Limited",0,O,"Ordinary shares",NULL
11431,1959972,"China Saite Group Company Limited",0,O,"Ordinary shares",NULL
1883,7328,"China Sandi Holdings Limited",0,O,"Ordinary shares",NULL
6172,60568,"China Sanjiang Fine Chemicals Company Limited",0,O,"Ordinary shares",NULL
5611,56247,"China SCE Group Holdings Limited",0,O,"Ordinary shares",NULL
2684,11157,"China Sci-Tech Industrial Investment Group Limited",0,O,"Ordinary shares",NULL
28671,2607992,"China Science and Education Industry Group Limited (KY)",0,O,"Ordinary shares",NULL
4995,45855,"China Shanshui Cement Group Limited",0,O,"Ordinary shares",NULL
12573,2265416,"China Shengmu Organic Milk Limited",0,O,"Ordinary shares",NULL
4595,26368,"China Shenhua Energy Company Limited",6,H,H-share,NULL
4648,23667,"CHINA SHINEWAY PHARMACEUTICAL GROUP LIMITED",0,O,"Ordinary shares",NULL
5059,47433,"China Shuifa Singyes Energy Holdings Limited",0,O,"Ordinary shares",NULL
25088,2563392,"China Shuifa Singyes New Materials Holdings Limited",0,O,"Ordinary shares",NULL
15580,2425547,"China Shun Ke Long Holdings Limited",0,O,"Ordinary shares",NULL
10285,1964076,"China Silver Group Limited",0,O,"Ordinary shares",NULL
4749,34384,"China Silver Technology Holdings Limited",0,O,"Ordinary shares",NULL
920,4665,"China Sinostar Group Company Limited",0,O,"Ordinary shares",NULL
389,3017,"China Smarter Energy Group Holdings Limited",0,O,"Ordinary shares",NULL
5202,51031,"China Smartpay Group Holdings Limited",0,O,"Ordinary shares",NULL
5621,4869,"CHINA SOLAR ENERGY HOLDINGS LIMITED",1,Wrnt,Warrant,2012-02-09
1092,4869,"CHINA SOLAR ENERGY HOLDINGS LIMITED",0,O,"Ordinary shares",NULL
5004,4869,"CHINA SOLAR ENERGY HOLDINGS LIMITED",1,Wrnt,Warrant,2009-11-12
5227,51514,"CHINA SOUTH CITY HOLDINGS LIMITED",0,O,"Ordinary shares",NULL
996,4798,"China Southern Airlines Company Limited",6,H,H-share,NULL
997,4799,"CHINA STAR ENTERTAINMENT LIMITED",0,O,"Ordinary shares",NULL
6035,4799,"CHINA STAR ENTERTAINMENT LIMITED",1,Wrnt,Warrant,2012-06-14
6999,4799,"CHINA STAR ENTERTAINMENT LIMITED",1,Wrnt,Warrant,2012-12-28
4901,41026,"China Starch Holdings Limited",0,O,"Ordinary shares",NULL
5888,57168,"CHINA STATE CONSTRUCTION DEVELOPMENT HOLDINGS LIMITED",0,O,"Ordinary shares",NULL
4598,26746,"CHINA STATE CONSTRUCTION INTERNATIONAL HOLDINGS LIMITED",0,O,"Ordinary shares",NULL
5005,26746,"CHINA STATE CONSTRUCTION INTERNATIONAL HOLDINGS LIMITED",1,Wrnt,Warrant,2009-02-27
11458,2055989,"China Success Finance Group Holdings Limited",0,O,"Ordinary shares",NULL
4937,41829,"China Sunshine Paper Holdings Company Limited",0,O,"Ordinary shares",NULL
6226,61118,"China Suntien Green Energy Corporation Limited",6,H,H-share,NULL
13327,2338590,"China Supply Chain Holdings Limited",0,O,"Ordinary shares",NULL
6015,58399,"China Taifeng Beddings Holdings Limited",0,O,"Ordinary shares",NULL
2738,12140,"CHINA TAIPING INSURANCE HOLDINGS COMPANY LIMITED",0,O,"Ordinary shares",NULL
1291,4999,"China Tangshang Holdings Limited",0,O,"Ordinary shares",NULL
2852,12659,"China Technology Industry Group Limited",0,O,"Ordinary shares",NULL
3310,17594,"CHINA TELECOM CORPORATION LIMITED",6,H,H-share,NULL
256,702,"China Tian Yuan Healthcare Group Limited",0,O,"Ordinary shares",NULL
28601,23170918,"China Tianbao Group Development Company Limited",0,O,"Ordinary shares",NULL
27470,12635399,"China Tianrui Automotive Interiors Co., LTD",0,O,"Ordinary shares",NULL
7288,135019,"China Tianrui Group Cement Company Limited",0,O,"Ordinary shares",NULL
4680,30900,"CHINA TING GROUP HOLDINGS LIMITED",0,O,"Ordinary shares",NULL
6002,58117,"China Titans Energy Technology Group Co., Limited",0,O,"Ordinary shares",NULL
28009,1032902,"CHINA TOBACCO INTERNATIONAL (HK) COMPANY LIMITED",0,O,"Ordinary shares",NULL
5479,53762,"China Tontine Wines Group Limited",0,O,"Ordinary shares",NULL
33377,61581,"China Tourism Group Duty Free Corporation Limited",6,H,H-share,NULL
26715,12082693,"China Tower Corporation Limited",6,H,H-share,NULL
1310,5015,"CHINA TRADITIONAL CHINESE MEDICINE HOLDINGS CO. LIMITED",0,O,"Ordinary shares",NULL
365,2838,"CHINA TRAVEL INTERNATIONAL INVESTMENT HONG KONG LIMITED",0,O,"Ordinary shares",NULL
34127,28388910,"China Treasures New Materials Group Ltd.",0,O,"Ordinary shares",NULL
3366,17026,"China Trends Holdings Limited",0,O,"Ordinary shares",NULL
19390,17026,"China Trends Holdings Limited",1,Wrnt,Warrant,2021-03-28
6521,63275,"China Trustful Group Limited",0,O,"Ordinary shares",NULL
9500,153040,"China U-Ton Future Space Industrial Group Holdings Ltd.",0,O,"Ordinary shares",NULL
2619,11359,"CHINA UNICOM (HONG KONG) LIMITED",0,O,"Ordinary shares",NULL
3096,15139,"China United Venture Investment Limited",0,O,"Ordinary shares",NULL
2919,13027,"China Uptown Group Company Limited",0,O,"Ordinary shares",NULL
5264,51687,"China Vanadium Titano-Magnetite Mining Company Limited",0,O,"Ordinary shares",NULL
6124,22530,"China Vanke Company Limited",6,H,H-share,NULL
12706,2248874,"China VAST Industrial Urban Development Company Limited",0,O,"Ordinary shares",NULL
1245,4970,"China Vered Financial Holding Corporation Limited",0,O,"Ordinary shares",NULL
28253,22870315,"China Wacan Group Company Limited",0,O,"Ordinary shares",NULL
25221,6714321,"China Wan Tong Yuan (Holdings) Limited",0,O,"Ordinary shares",NULL
21444,2573322,"China Wantian Holdings Limited",0,O,"Ordinary shares",NULL
2296,9446,"CHINA WATER AFFAIRS GROUP LIMITED",0,O,"Ordinary shares",NULL
3016,14535,"CHINA WATER INDUSTRY GROUP LIMITED",0,O,"Ordinary shares",NULL
7281,134863,"China Weaving Materials Holdings Limited",0,O,"Ordinary shares",NULL
5532,55439,"China Wood International Holding Co., Limited",0,O,"Ordinary shares",NULL
11691,1942942,"China Wood Optimization (Holding) Limited",0,O,"Ordinary shares",NULL
26127,12102909,"China Xinhua Education Group Limited",0,O,"Ordinary shares",NULL
5516,55296,"CHINA XLX FERTILISER LTD.",0,O,"Ordinary shares",NULL
9420,1849008,"China Yongda Automobiles Services Holdings Limited",0,O,"Ordinary shares",NULL
31321,25276436,"China Youran Dairy Group Limited",0,O,"Ordinary shares",NULL
17364,2330766,"China YouYuan Dairy Holdings Company Limited",0,O,"Ordinary shares",NULL
18249,2299584,"China Yu Tian Holdings Limited",0,O,"Ordinary shares",NULL
22970,2605980,"China YuHua Education Corporation Limited",0,O,"Ordinary shares",NULL
4634,29818,"China Yurun Food Group Limited",0,O,"Ordinary shares",NULL
4845,13561,"China Zenith Chemical Group Limited",1,Wrnt,Warrant,2008-04-15
2948,13561,"China Zenith Chemical Group Limited",0,O,"Ordinary shares",NULL
6456,62672,"China ZhengTong Auto Services Holdings Limited",0,O,"Ordinary shares",NULL
19428,46012,"CHINA ZHESHANG BANK CO., LTD.",6,H,H-share,NULL
5090,48879,"China Zhongwang Holdings Limited",0,O,"Ordinary shares",NULL
999,4801,"CHINA-HONGKONG PHOTO PRODUCTS HOLDINGS LIMITED",0,O,"Ordinary shares",NULL
35336,31922707,"ChinaAMC 20+ Year US Treasury Bond Accumulating ETF",10,Unit,Unit,NULL
35333,31922704,"ChinaAMC 20+ Year US Treasury Bond Distributing ETF",10,Unit,Unit,NULL
35334,31922704,"ChinaAMC 20+ Year US Treasury Bond Distributing ETF",10,Unit,Unit,NULL
35335,31922704,"ChinaAMC 20+ Year US Treasury Bond Distributing ETF",10,Unit,Unit,NULL
12909,2341739,"ChinaAMC Asia High Dividend ETF",10,Unit,Unit,NULL
12907,2341737,"ChinaAMC Asia USD Investment Grade Bond ETF",10,Unit,Unit,NULL
27732,2341737,"ChinaAMC Asia USD Investment Grade Bond ETF",10,Unit,Unit,NULL
35171,31707251,"ChinaAMC Bitcoin ETF",10,Unit,Unit,NULL
35172,31707251,"ChinaAMC Bitcoin ETF",10,Unit,Unit,NULL
35173,31707251,"ChinaAMC Bitcoin ETF",10,Unit,Unit,NULL
31459,16747097,"ChinaAMC Bloomberg China Treasury + Policy Bank Bond Index ETF",10,Unit,Unit,NULL
26525,16747097,"ChinaAMC Bloomberg China Treasury + Policy Bank Bond Index ETF",10,Unit,Unit,NULL
26526,16747097,"ChinaAMC Bloomberg China Treasury + Policy Bank Bond Index ETF",10,Unit,Unit,NULL
11138,2120280,"ChinaAMC CES China A80 Index ETF",10,Unit,Unit,NULL
11139,2120280,"ChinaAMC CES China A80 Index ETF",10,Unit,Unit,NULL
29537,24882440,"ChinaAMC CSI 300 Index Daily (-1x) Inverse Product",10,Unit,Unit,NULL
29538,24882441,"ChinaAMC CSI 300 Index Daily (2x) Leveraged Product",10,Unit,Unit,NULL
9646,1922298,"ChinaAMC CSI 300 Index ETF",10,Unit,Unit,NULL
9949,1922298,"ChinaAMC CSI 300 Index ETF",10,Unit,Unit,NULL
23533,2710697,"ChinaAMC Direxion Hang Seng China Enterprises Index Daily (-1x) Inverse Product",10,Unit,Unit,NULL
23532,2710696,"ChinaAMC Direxion Hang Seng China Enterprises Index Daily (2x) Leveraged Product",10,Unit,Unit,NULL
35168,31707248,"ChinaAMC Ether ETF",10,Unit,Unit,NULL
35169,31707248,"ChinaAMC Ether ETF",10,Unit,Unit,NULL
35170,31707248,"ChinaAMC Ether ETF",10,Unit,Unit,NULL
34945,26429979,"ChinaAMC Hang Seng Biotech ETF",10,Unit,Unit,NULL
30754,26429979,"ChinaAMC Hang Seng Biotech ETF",10,Unit,Unit,NULL
31460,26429979,"ChinaAMC Hang Seng Biotech ETF",10,Unit,Unit,NULL
23534,2710698,"ChinaAMC Hang Seng Index Daily (-1x) Inverse Product",10,Unit,Unit,NULL
23535,2710699,"ChinaAMC Hang Seng Index Daily (2x) Leveraged Product",10,Unit,Unit,NULL
16475,2486921,"ChinaAMC Hang Seng Stock Connect Hong Kong SmallCap Index ETF",10,Unit,Unit,NULL
29660,25069414,"ChinaAMC Hang Seng TECH Index ETF",10,Unit,Unit,NULL
29661,25069414,"ChinaAMC Hang Seng TECH Index ETF",10,Unit,Unit,NULL
34944,25069414,"ChinaAMC Hang Seng TECH Index ETF",10,Unit,Unit,NULL
12908,2341738,"ChinaAMC Hong Kong Banks ETF",10,Unit,Unit,NULL
33637,28766523,"ChinaAMC HSI ESG ETF",10,Unit,Unit,NULL
33638,28766523,"ChinaAMC HSI ESG ETF",10,Unit,Unit,NULL
33639,28766523,"ChinaAMC HSI ESG ETF",10,Unit,Unit,NULL
19064,2536561,"ChinaAMC MSCI Asia Pacific Real Estate ETF",10,Unit,Unit,NULL
32632,27590007,"ChinaAMC MSCI China A 50 Connect ETF",10,Unit,Unit,NULL
32633,27590007,"ChinaAMC MSCI China A 50 Connect ETF",10,Unit,Unit,NULL
32634,27590007,"ChinaAMC MSCI China A 50 Connect ETF",10,Unit,Unit,NULL
25920,12745857,"ChinaAMC MSCI China A Inclusion Index ETF",10,Unit,Unit,NULL
25921,12745857,"ChinaAMC MSCI China A Inclusion Index ETF",10,Unit,Unit,NULL
19063,2536560,"ChinaAMC MSCI Europe Quality Hedged to USD ETF",10,Unit,Unit,NULL
35706,32374063,"ChinaAMC MSCI India ETF",10,Unit,Unit,NULL
35707,32374063,"ChinaAMC MSCI India ETF",10,Unit,Unit,NULL
35708,32374063,"ChinaAMC MSCI India ETF",10,Unit,Unit,NULL
19062,2536559,"ChinaAMC MSCI Japan Hedged to USD ETF",10,Unit,Unit,NULL
19065,2536562,"ChinaAMC NASDAQ 100 ETF",10,Unit,Unit,NULL
27733,2536562,"ChinaAMC NASDAQ 100 ETF",10,Unit,Unit,NULL
21324,2637133,"ChinaAMC NASDAQ-100 Index Daily (-1x) Inverse Product",10,Unit,Unit,NULL
28347,23621526,"ChinaAMC NASDAQ-100 Index Daily (-2x) Inverse Product",10,Unit,Unit,NULL
21323,2637131,"ChinaAMC NASDAQ-100 Index Daily (2x) Leveraged Product",10,Unit,Unit,NULL
34430,30239422,"ChinaAMC RMB Money Market ETF",10,Unit,Unit,NULL
34431,30239422,"ChinaAMC RMB Money Market ETF",10,Unit,Unit,NULL
10504,1894887,"Chinalco Mining Corporation International",0,O,"Ordinary shares",NULL
3375,18160,"CHINASOFT INTERNATIONAL LIMITED",0,O,"Ordinary shares",NULL
2480,10368,"Chinese Energy Holdings Limited",0,O,"Ordinary shares",NULL
146,1579,"CHINESE ESTATES HOLDINGS LIMITED",0,O,"Ordinary shares",NULL
3408,18177,"Chinese Food and Beverage Group Limited",0,O,"Ordinary shares",NULL
1116,4887,"Chinese People Holdings Company Limited",0,O,"Ordinary shares",NULL
2509,10787,"Chinese Strategic Holdings Limited",0,O,"Ordinary shares",NULL
19534,2514657,"Ching Lee Holdings Limited",0,O,"Ordinary shares",NULL
2613,11315,"Chinlink International Holdings Limited",0,O,"Ordinary shares",NULL
108,1179,"CHINNEY ALLIANCE GROUP LIMITED",0,O,"Ordinary shares",NULL
95,1059,"CHINNEY INVESTMENTS, LIMITED",0,O,"Ordinary shares",NULL
15847,2468276,"Chinney Kin Wing Holdings Limited",0,O,"Ordinary shares",NULL
933,421,"CHK Oil Limited (BM)",0,O,"Ordinary shares",NULL
26943,13042325,"Chong Fai Jewellery Group Holdings Company Limited (KY)",0,O,"Ordinary shares",NULL
149,420,"Chong Hing Bank Limited",0,O,"Ordinary shares",NULL
21380,2614630,"CHONG KIN GROUP HOLDINGS LIMITED",0,O,"Ordinary shares",NULL
6407,62118,"Chong Sing Holdings FinTech Group Limited",0,O,"Ordinary shares",NULL
33408,27291273,"Chongqing Hongjiu Fruit Co., Limited",6,H,H-share,NULL
1001,4803,"Chongqing Iron & Steel Company Limited",6,H,H-share,NULL
4990,45615,"Chongqing Machinery & Electric Co., Ltd.",6,H,H-share,NULL
6474,62802,"Chongqing Rural Commercial Bank Co., Ltd.",6,H,H-share,NULL
1002,4804,"CHOW SANG SANG HOLDINGS INTERNATIONAL LIMITED",0,O,"Ordinary shares",NULL
7241,134489,"Chow Tai Fook Jewellery Group Limited",0,O,"Ordinary shares",NULL
8782,150949,"Christine International Holdings Limited",0,O,"Ordinary shares",NULL
1044,4833,"CHTC Fong's International Company Limited",0,O,"Ordinary shares",NULL
5615,56299,"Chu Kong Petroleum and Natural Gas Steel Pipe Holdings Limited",0,O,"Ordinary shares",NULL
1003,4805,"Chu Kong Shipping Enterprises (Group) Company Limited",0,O,"Ordinary shares",NULL
20220,2489248,"Chuan Holdings Limited",0,O,"Ordinary shares",NULL
1004,4806,"Chuang's China Investments Limited",0,O,"Ordinary shares",NULL
1005,2452,"CHUANG'S CONSORTIUM INTERNATIONAL LIMITED",0,O,"Ordinary shares",NULL
4535,23491,"Chuanglian Holdings Limited (KY)",0,O,"Ordinary shares",NULL
3349,14416,"CHYY DEVELOPMENT GROUP LIMITED",0,O,"Ordinary shares",NULL
27361,22515496,"CICC Bloomberg China Treasury 1-10 Years ETF",10,Unit,Unit,NULL
27362,22515496,"CICC Bloomberg China Treasury 1-10 Years ETF",10,Unit,Unit,NULL
32922,28022142,"CICC Carbon Futures ETF",10,Unit,Unit,NULL
32923,28022142,"CICC Carbon Futures ETF",10,Unit,Unit,NULL
32924,28022142,"CICC Carbon Futures ETF",10,Unit,Unit,NULL
27334,22486106,"CICC CSI Select 100 Fund",10,Unit,Unit,NULL
27335,22486106,"CICC CSI Select 100 Fund",10,Unit,Unit,NULL
30129,25481899,"CICC HKD Money Market ETF",10,Unit,Unit,NULL
26178,13525157,"CICC KraneShares CSI China Internet Index ETF",10,Unit,Unit,NULL
26179,13525157,"CICC KraneShares CSI China Internet Index ETF",10,Unit,Unit,NULL
26180,13525157,"CICC KraneShares CSI China Internet Index ETF",10,Unit,Unit,NULL
10109,153079,"CIFI Holdings (Group) Co. Ltd.",0,O,"Ordinary shares",NULL
1009,1368,"CIL HOLDINGS LIMITED",0,O,"Ordinary shares",NULL
4659,30125,"CIMC Enric Holdings Limited",0,O,"Ordinary shares",NULL
27871,22535533,"CIMC Vehicles (Group) Co., Ltd.",6,H,H-share,NULL
3328,17031,"CIMC-TianDa Holdings Company Limited",0,O,"Ordinary shares",NULL
2690,11915,"Cinda International Holdings Limited",0,O,"Ordinary shares",NULL
26595,12681863,"Cinese International Group Holdings Limited (KY)",0,O,"Ordinary shares",NULL
2963,13556,"CircuTech International Holdings Limited",0,O,"Ordinary shares",NULL
35452,30094765,"Cirrus Aircraft Limited",0,O,"Ordinary shares",NULL
29060,22905778,"Cirtek Holdings Limited",0,O,"Ordinary shares",NULL
12911,61078,"Cisco Systems, Inc.",0,O,"Ordinary shares",NULL
184,581,"CITIC INTERNATIONAL FINANCIAL HOLDINGS LIMITED",0,O,"Ordinary shares",NULL
51,379,"CITIC Limited (HK)",0,O,"Ordinary shares",NULL
317,2585,"CITIC RESOURCES HOLDINGS LIMITED",0,O,"Ordinary shares",NULL
6378,8876,"CITIC Securities Company Limited",6,H,H-share,NULL
4837,38755,"CITIC Telecom International Holdings Limited",0,O,"Ordinary shares",NULL
223,1957,"CITYCHAMP WATCH & JEWELLERY GROUP LIMITED",0,O,"Ordinary shares",NULL
13537,2377099,"CK Asset Holdings Limited (KY)",0,O,"Ordinary shares",NULL
44,488,"CK Hutchison Holdings Limited",0,O,"Ordinary shares",NULL
49,784,"CK Infrastructure Holdings Limited",0,O,"Ordinary shares",NULL
3384,17035,"CK LIFE SCIENCES INT'L., (HOLDINGS) INC.",0,O,"Ordinary shares",NULL
6725,64523,"CL Group (Holdings) Limited",0,O,"Ordinary shares",NULL
32812,23056875,"Clarity Medical Group Holding Limited",0,O,"Ordinary shares",NULL
20647,2351509,"Classified Group (Holdings) Limited",0,O,"Ordinary shares",NULL
4555,15401,"CLEAR MEDIA LIMITED (BM)",0,O,"Ordinary shares",NULL
260,438,"Clear Water Bay Land Company Limited",0,O,"Ordinary shares",NULL
21742,2532605,"Clifford Modern Living Holdings Limited",0,O,"Ordinary shares",NULL
35310,28000575,"Cloud Factory Technology Holdings Limited",0,O,"Ordinary shares",NULL
4819,14788,"Cloud Investment Holdings Limited (KY)",1,Wrnt,Warrant,2009-01-23
3070,14788,"Cloud Investment Holdings Limited (KY)",0,O,"Ordinary shares",NULL
6700,14788,"Cloud Investment Holdings Limited (KY)",1,Wrnt,Warrant,2013-02-17
33209,27172371,"ClouDr Group Limited",0,O,"Ordinary shares",NULL
32447,26926783,"Clover Biopharmaceuticals, Ltd.",0,O,"Ordinary shares",NULL
63,341,"CLP HOLDINGS LIMITED",0,O,"Ordinary shares",NULL
10896,153014,"CLSA Premium Limited",0,O,"Ordinary shares",NULL
4672,30696,"CM Energy Tech Co., Ltd.",0,O,"Ordinary shares",NULL
29764,23966385,"CM Hi-Tech Cleanroom Limited",0,O,"Ordinary shares",NULL
253,448,"CMB WING LUNG BANK LIMITED",0,O,"Ordinary shares",NULL
1342,5047,"CMBC Capital Holdings Limited",0,O,"Ordinary shares",NULL
13186,5047,"CMBC Capital Holdings Limited",1,Wrnt,Warrant,2016-01-26
18890,5047,"CMBC Capital Holdings Limited",1,Wrnt,Warrant,2017-02-13
9110,5047,"CMBC Capital Holdings Limited",1,Wrnt,Warrant,2014-03-07
28542,14731647,"CMGE Technology Group Limited",0,O,"Ordinary shares",NULL
4844,39099,"CMOC Group Limited (CN)",6,H,H-share,NULL
22075,2448034,"CMON Limited",0,O,"Ordinary shares",NULL
36239,33195215,"CMS Hang Seng Tech Index ETF",10,Unit,Unit,NULL
29805,24519259,"CN Logistics International Holdings Limited (KY)",0,O,"Ordinary shares",NULL
3330,18115,"CNNC International Limited",0,O,"Ordinary shares",NULL
2942,9164,"CNOOC LIMITED",0,O,"Ordinary shares",NULL
34310,9164,"CNOOC LIMITED",0,O,"Ordinary shares",NULL
9859,153294,"CNQC International Holdings Limited",0,O,"Ordinary shares",NULL
1013,598,"CNT GROUP LIMITED",0,O,"Ordinary shares",NULL
1014,4722,"COASTAL GREENLAND LIMITED",0,O,"Ordinary shares",NULL
1229,967,"Cocoon Holdings Limited",0,O,"Ordinary shares",NULL
21639,2602623,"COFCO Joycome Foods Limited",0,O,"Ordinary shares",NULL
12475,2114427,"Colour Life Services Group Co., Limited",0,O,"Ordinary shares",NULL
3429,18200,"COMBA TELECOM SYSTEMS HOLDINGS LIMITED",0,O,"Ordinary shares",NULL
3377,16961,"Combest Holdings Limited",0,O,"Ordinary shares",NULL
5066,48018,"Come Sure Group (Holdings) Limited",0,O,"Ordinary shares",NULL
1393,5450,"COMPUTER AND TECHNOLOGIES HOLDINGS LIMITED",0,O,"Ordinary shares",NULL
4774,36347,"COMPUTIME GROUP LIMITED",0,O,"Ordinary shares",NULL
20115,2576442,"ComStage 1 DAX UCITS ETF",10,Unit,Unit,NULL
20116,2576443,"ComStage 1 DivDAX UCITS ETF",10,Unit,Unit,NULL
5458,52755,"Comtec Solar Systems Group Limited",0,O,"Ordinary shares",NULL
34917,28340380,"Concord Healthcare Group Co., Ltd.",6,H,H-share,NULL
1163,3386,"Concord New Energy Group Limited",0,O,"Ordinary shares",NULL
28439,22881511,"Confidence Intelligence Holdings Limited",0,O,"Ordinary shares",NULL
1456,6044,"Congyu Intelligent Agricultural Holdings Limited",0,O,"Ordinary shares",NULL
11621,152734,"Consun Pharmaceutical Group Limited",0,O,"Ordinary shares",NULL
28222,13795735,"Contel Technology Company Limited",0,O,"Ordinary shares",NULL
437,3297,"Continental Aerospace Technologies Holding Limited (BM)",0,O,"Ordinary shares",NULL
1017,4812,"CONTINENTAL HOLDINGS LIMITED",0,O,"Ordinary shares",NULL
36060,32283401,"ContiOcean Environment Tech Group Co., Ltd.",6,H,H-share,NULL
2860,12696,"CONVENIENCE RETAIL ASIA LIMITED",0,O,"Ordinary shares",NULL
6059,58895,"Convoy Global Holdings Limited",0,O,"Ordinary shares",NULL
25217,2703468,"Cool Link (Holdings) Limited",0,O,"Ordinary shares",NULL
4540,23771,"Coolpad Group Limited",0,O,"Ordinary shares",NULL
25935,11778161,"COOLPOINT INNONISM HOLDING LIMITED",0,O,"Ordinary shares",NULL
7012,67200,"Cornerstone Financial Holdings Limited",0,O,"Ordinary shares",NULL
26331,11785970,"Cornerstone Technologies Holdings Limited",0,O,"Ordinary shares",NULL
3600,21272,"COSCO SHIPPING Development Co., Ltd.",6,H,H-share,NULL
1231,4960,"COSCO SHIPPING Energy Transportation Co., Ltd.",6,H,H-share,NULL
4601,27051,"COSCO SHIPPING Holdings Co., Ltd.",6,H,H-share,NULL
414,3185,"COSCO SHIPPING International (Hong Kong) Co., Ltd.",0,O,"Ordinary shares",NULL
360,818,"COSCO SHIPPING Ports Limited",0,O,"Ordinary shares",NULL
2227,9118,"COSLIGHT TECHNOLOGY INTERNATIONAL GROUP LIMITED",0,O,"Ordinary shares",NULL
12486,2227112,"Cosmo Lady (China) Holdings Company Limited",0,O,"Ordinary shares",NULL
255,2233,"COSMOPOLITAN INTERNATIONAL HOLDINGS LIMITED",0,O,"Ordinary shares",NULL
1020,4814,"COSMOS MACHINERY ENTERPRISES LIMITED",0,O,"Ordinary shares",NULL
963,4774,"Cosway Corporation Limited",0,O,"Ordinary shares",NULL
4841,38940,"Country Garden Holdings Company Limited",0,O,"Ordinary shares",NULL
26535,13595987,"Country Garden Services Holdings Company Limited",0,O,"Ordinary shares",NULL
6978,66856,"Courage Investment Group Limited",0,O,"Ordinary shares",NULL
13651,2330165,"Cowell e Holdings Inc.",0,O,"Ordinary shares",NULL
25045,2649241,"CPM Group Limited (KY)",0,O,"Ordinary shares",NULL
5478,53577,"CPMC Holdings Limited",0,O,"Ordinary shares",NULL
28432,11789207,"CR Construction Group Holdings Limited",0,O,"Ordinary shares",NULL
687,3771,"Crazy Sports Group Limited",0,O,"Ordinary shares",NULL
17722,2452282,"CRCC High-Tech Equipment Corporation Limited",6,H,H-share,NULL
17024,2172808,"Creative China Holdings Limited",0,O,"Ordinary shares",NULL
27336,17799589,"Creative Enterprise Holdings Limited",0,O,"Ordinary shares",NULL
127,1492,"CROCODILE GARMENTS LIMITED",0,O,"Ordinary shares",NULL
171,347,"CROSS-HARBOUR (HOLDINGS) LIMITED (THE)",0,O,"Ordinary shares",NULL
21117,2590938,"CROSSTEC Group Holdings Limited",0,O,"Ordinary shares",NULL
1358,5140,"Crown International Corporation Limited",0,O,"Ordinary shares",NULL
5002,5140,"Crown International Corporation Limited",1,Wrnt,Warrant,2009-08-07
5030,46206,"CRRC Corporation Limited",6,H,H-share,NULL
33871,27761472,"Cryofocus Medtech (Shanghai) Co., Ltd.",6,H,H-share,NULL
3379,15999,"Crypto Flow Technology Limited",0,O,"Ordinary shares",NULL
25389,6714320,"Crystal International Group Limited",0,O,"Ordinary shares",NULL
22092,2612147,"CSC Financial Co., Ltd.",6,H,H-share,NULL
379,2911,"CSC Holdings Limited (HK)",0,O,"Ordinary shares",NULL
1173,4930,"CSI Properties Limited (BM)",0,O,"Ordinary shares",NULL
36234,4930,"CSI Properties Limited (BM)",1,Wrnt,Warrant,2027-04-07
36208,33147083,"CSOP Berkshire Daily (2x) Leveraged Product",10,Unit,Unit,NULL
36209,33147083,"CSOP Berkshire Daily (2x) Leveraged Product",10,Unit,Unit,NULL
35467,32076867,"CSOP Bitcoin Futures Daily (-1x) Inverse Product",10,Unit,Unit,NULL
33847,28799878,"CSOP Bitcoin Futures ETF",10,Unit,Unit,NULL
11188,2130682,"CSOP CES China A80 ETF",10,Unit,Unit,NULL
11189,2130682,"CSOP CES China A80 ETF",10,Unit,Unit,NULL
16476,2486922,"CSOP China CSI 300 Smart ETF",10,Unit,Unit,NULL
16477,2486922,"CSOP China CSI 300 Smart ETF",10,Unit,Unit,NULL
31678,26986463,"CSOP China Healthcare Disruption Index ETF",10,Unit,Unit,NULL
36214,33169923,"CSOP Coinbase Daily (-2x) Inverse Product",10,Unit,Unit,NULL
36215,33169923,"CSOP Coinbase Daily (-2x) Inverse Product",10,Unit,Unit,NULL
36216,33169925,"CSOP Coinbase Daily (2x) Leveraged Product",10,Unit,Unit,NULL
36217,33169925,"CSOP Coinbase Daily (2x) Leveraged Product",10,Unit,Unit,NULL
29534,24880578,"CSOP CSI 300 Index Daily (-1x) Inverse Product",10,Unit,Unit,NULL
29535,24880579,"CSOP CSI 300 Index Daily (2x) Leveraged Product",10,Unit,Unit,NULL
29117,24357097,"CSOP CSI 500 ETF",10,Unit,Unit,NULL
29118,24357097,"CSOP CSI 500 ETF",10,Unit,Unit,NULL
33524,28740300,"CSOP CSI Brokerage Index Daily (2x) Leveraged Product",10,Unit,Unit,NULL
33846,28799876,"CSOP Ether Futures ETF",10,Unit,Unit,NULL
9753,1945374,"CSOP FTSE China A50 ETF",10,Unit,Unit,NULL
10009,1945374,"CSOP FTSE China A50 ETF",10,Unit,Unit,NULL
30473,25674618,"CSOP FTSE China A50 Index Daily (-1x) Inverse Product",10,Unit,Unit,NULL
30474,25674626,"CSOP FTSE China A50 Index Daily (2x) Leveraged Product",10,Unit,Unit,NULL
